,tweet
0,ini dia penyebab harga telur ayam turun
1,harga telor sama daging ayam turunkok harga benang naik rb dalam kurun seminggu gaezzwat te pak
2,nampaknya hujan tak akan turun yang turun harga telur
3,ini harga telor ayam lagi turun yakaget beli telur kg cuma ribu
4,pemerintah diminta segera turun tangan karena harga telur ayam terus anjlok gerindra gerindrareses tetapkerja darirakyat kerjautkrakyat indonesiaraya utkrakyat
5,harga sembako hari ini ibuibu harga telur naik rp per kg dan cabai rawit hijau turun rp
6,biasanya rri selslu menyisrkan harga telur turun naik harga kacang kejepit
7,hukum equilibrium supply demand nya ngga senatural itu pak ada pengaruh hatching egg hetelur tetasan utk bibit yg melonjakkan angka supply konsekuensinya harga turun idealnya he ini kl kelebihan ya dihancurkan prakteknya perush besar breeding kan ga mau
8,harga telor disini masih turun sekitar rbkg
9,harga telur di beberapa pasar di bandar lampung mengalami penurunan hingga rp per kilogram para pedagang mengatakan harga telur kembali turun sejak tiga hari lalu
10,kalo harga naik emg harus gmn lah ini harga telur turun dan biaya pakan naik selama bulan harus nutup biaya pakan sampe mampus
11,harga telur ayam di pasaran terus turun peternak pun mulai babak belur mereka sampai turun ke jalan melakukan aksi di jakarta
12,harga telur ayam di pasaran terus turun peternak pun mulai babak belur mereka sampai turun ke jalan melakukan aksi di jakarta
13,di stabilkan bisakah kl tdk bisa ya hukum ekonomi umum yg tetap akn berlaku peternak dadakan mati jd jumlah ayam berkurang mk kebutuhan pakan berkurang harga pakan turun daging ayam dan telur berkurang kebutuhan nya tetap mk harga daging dan telur naik dan stabil
14,harga telur ayam di pasaran terus turun peternak pun mulai babak belur mereka sampai turun ke jalan melakukan aksi di jakarta
15,harga telur makin turun sosis makin naik sedangkan harga susu naik turun kadrun pasti konotasinya lgs ke selangkangan harga telur ayam di pasaran terus turun peternak pun mulai babak belur mereka sampai turun ke jalan melakukan aksi di jakarta
16,harga turun itu banyak sebab sebenarnya salah satunya karena barang yg di maksud mudah di dapat dan banyak yg jual titik terang balada harga telur yang bikin peternak babak belur
17,harga telur ayam di pasaran terus turun peternak pun mulai babak belur mereka sampai turun ke jalan melakukan aksi di jakarta
18,harga telur ayam terus turun garagara kelebihan pasokan menanggapi hal itu pemerintah mau menyerap telur untuk disalurkan sebagai bantuan sosial bansos
19,harga telur turun tapi minyak naik
20,sebenarnya dg turun nya harga telur dan daging itu berarti keberhasilan pemerintah dalam memakmurkan rakyat nya
21,para peternak ayam dari berbagai daerah melakukan sederet aksi di jakarta para peternak protes harga telur ayam terus turun dan membuat merugi
22,new post harga telur cuma rp ribu per kilo ratusan peternak turun ke jalan has been published on baca pesan
23,gabungan elemen mahasiswa bem si yang berada di jakarta menggelar aksi darurat perunggasan nasional dengan turun ke jalan mereka menuntut kestabilan harga ayam dan telur bagi para peternak rakyat mandiri
24,kasian pemerintah ya harga telur naik masyarakat teriak harga telur turun peternak yg teriakterus maunya gimana toh
25,asli sbg buka usaha yg bahan komoditinya dari telor seneng harga telor turun tapi kalo liat berita miriss kasian mereka peternak
26,mesti la harga telur dia turun sbb telur dia pun dah turun ke paeas lutut
27,harga telur dia akan turun
28,harga telur dan ayam akan turun kata annuar muso selepas letih berzumba
29,kita tengok harga jualan ayam biasa amp telur gred menjelang hari nanti berapa percent turun agaknya
30,harga telur yang kian turun disebabkan karena pasokan telur yang melimpah di pasaran namun permintaan dari masyarakat malah menurun hal ini disebabkan daya beli masyarakat yang menurun seperti disampaikan oleh presiden joko widodo saat rakornas pengendalian inflasi
31,menteri pertanian syahrul yasin limpo segera siuman minum air putih turun ke lapangan harga telur harga jagung harga kedelai ededeh
32,harga telur katanya turuntapi di pasaran harga telur sekarang karpet rbu dari harga bubagaimana ini ibu
33,harga telur turun gilagilaan gerindra beri nasihat ke pemerintah
34,harga telur yang berangsur turun pedagang sepi pembeli mari kita bersama percaya dan berdoa besok harinya akan lebih baik habis gelap pasti terbitlah terang selamat hari telur sedunia wahai peternak dunia
35,di tempat kami harga telur naik turun harga kacang kejepit
36,an barang terus meningkat sdgkan permintaan tetap ya harap maklum jika harga turun dan barang spt telur khan tdk bisa di buffersimpan terlalu lama mohon ahli nya beri pencerahan dimana sebtl nya permasalahan nya
37,harga telur blitar semakin turun saja
38,harga telur turun naik
39,ya gini deh mbak kalo bapakbapak ketemu ibuibu kan yg dibahas harga emas sama harga telor ayam yg naik turun
40,pantesan semingguan ini belanja rb dapet seabrek kyk belanja rb di hari normal emang harga sayur lg turun telor juga sekilo biasa an skrg rb
41,sama kaya di nganjuk termasuk harga telur ayam dengerdenger mau ada demo krn harga telur turun parah
42,hargatelur di tingkat peternak saat ini berangsur naik setelah sebelumnya turun hanya rpkg rpribukg saat ini harga telur di wilayah palas lampung selatan naik menjadi rpribukg
43,harga telur di aceh singkil turun per papan dijual rp ribu
44,harga telur ayam ras turun picu deflasi di jawa timur
45,harga telur lagi turun yaa barusan beli kg rb bener ni harga telur kalo naik atau turun ngga signifikan terakhir tuh rb
46,trimakasih harga telor turun lagi
47,harga telor turun
48,harga jagung murahtelur turun jangan turunkan telurnanti jadi jagung mahal kuncinya harga jagung pas
49,beli cabe kiloan beli sambelan ribuan mbak telor lagi turun harga nih mau beli gak mbak bude udah nyiapin kepala yang tebel kulitnya nanti tinggal bayar aja seperti biasa tehhh galonnya saya pinjem lagi ya nanti baksonya saya anterin ke rumah
50,yg rugi kemarin peternak skrg yg rugi peternak plus petani harga jagung turun harga telor gak naik juga
51,dampak ppkm harga telur di kabupaten bandung turun
52,kalo judi kan kita pasang taruhan kalo saham kan jual beli sama kayak kita punya barang misal jualan telur nah harga telur kan bisa naik dan bisa turun tergantung permintaan pasar saham juga begitu dasarnya
53,harga telur ayam hingga cabai rawit turun september deflasi
54,barang yg pendek jangka waktunya awal pandemi harga telur naik tajam setahun kemudian krn daya beli masyarakat turun akibat ppkm jokowi harga turun padahal bahan makanan penting utk kesehatan
55,harga telur turun terus terungkap alasan di baliknya
56,ini peternak ayam petelur bener colaps ayam dijual murah krena harga telur turun gag cukup buat beli pakan
57,sebut saja banteng membangun benteng dibangun dengan hutang rakyat dikerjapaksakan untuk bayar hutang hanya pajak pajak melejit yg diterima harga telor aja bisa turun pajak kok gak bisa kalah dong pejabat dgn ayam
58,protes harga turun peternak di magetan bagikan telur cumacuma
59,kalo dipikir harga telur anjlok walaupun harga produksinya mahal harga pakanjagung naik jangan karena daya beli masyarakat mulai turun lagi jadinya permintaankonsumsi telur turun telur sumber protein mayoritas orang indonesia karena dagingayam relatif mahal
60,nah ini yg jadi khawatir bener konsumen seneng sebab murah tapi peternak juga sumpek disaat harga pakan dan perawatan lain harga tetap bahkan naik tapi harga telur turun bisa bisa rugi kalau telur turun harusnya dibarengi dengan pakan dan perawatan lain turun juga heheheh
61,didu didu saya ini pedagang harga telur turun karena supply di pasar cukup banyak tp dlm minggu ini sdh beranjak naik kembali kita pernah belajar ekonomi hal sepertiadalah biasa gk perlu buru tuduh sana sini saya tahu anda salah mulu
62,setahu sy integrator blm ada yg punya kdg layer komersil sendiri di broiler banyak harga telur turun lbh cenderung kemarin di pacuindikasikn krn telur tetas lari ke komersil jg ppkm yg panjang imbasnya ke daya beli di prparah harga jagung naik jagung ongks pakan
63,kami pembeli senang harga telor turun dan semoga begini terus
64,kami di timur indonesia hanya bisa baca berita harga telur turun harga daging ayam turun tapi di sini ga pernah turun
65,harga telur udah murah harga cabe udah murah ayam murah harga pakan bentar lagi turun harga yang lain ikutan murah trus kenapa harga indomie ga ikut turuuuunn kan ga fair manufacture memang gitu ga ngerti turunin harga turunin kek jadi lagi turunin dong
66,pengusaha serakahtelur turun smp rb rb per kgtapi blm pernah nemu harga segitu kl beli di pasaranhayo siapa yg ingin memperkaya diri
67,ok justru waktu bansos isinya telur harga telur naik sempet perkilo rb dr peternak dipasar ato warung jual rbkgskr hrga turun rbkgsy ngewarung jual rb kg
68,ayam suruh ngempet aja jangan betelurya teori ekonomi sedang bekerja banyak suplai ya harga turun klo banyak permintaan harga naikkalau dr sisi konsumen ekonomi lemah mereka jelas terbantu biasa gak makan telor skrg bisa
69,gw tiap pergi dan pulang kerja lewat sebuah warung disana dipampang harga telor perkilo dari rb turun rb turun terus sampai rb tp pagi udah ke rb lagi kemungkinan di harga para bandar udah borongstock skrg ditahan lg biar harga merangkak naik lg
70,turun drastis itu harga telur mbah
71,liat berita peternak ayam merugi karna harga telor dan daging ayam turun trus berniat menggugat pemerintah triliun gue yg cuma hah heh hoh doang kok ada manusia begitu kalo mau jadi pengusaha harus siap resiko apalagi ini lagi momen musibah seperti ini daya beli masyarakat
72,harga telor turun peternak ayam petelur ribut seperti cacing kepanasanharga telor naik peternak telor senangnya gak ketolongankalau mau naik terus tanam kelapa saja pasti panennya naik
73,ketika harga ayam kg mereka hurahura ketika harga telur turun mereka orakan semua menyalahkan pemerintah
74,berdagang itu ada untung dan rugi jadi kalau harga ayam dan telur itu turun rakyat akan bersyukur dan berterima kasih karena bisa membeli ayam dan telur dengan harga murah untuk dimakan kenapa kalian harus menggugat pak jokowi dan menteri
75,pantes kemarenan emak gw beli telor banyak bet makan suruh pake telor terus lg turun harga telor ternyata
76,naiknya harga pakan ayam ini diperparah dengan turunnya harga telur ayam di tingkat peternak harga telur di pasaran turun drastis dari rp ribu per kilogram menjadi rp ribu per kilogramnya
77,harga telor turun harga naik diem wae
78,hmmmm buibu baru pulang dari pasar harga telor udah turun ya bu
79,kan kalo uangnya makin banyakharga barang juga makin tinggi jadi biaya produksinya jg makin mahal jadi harga barang makin tinggi nilai uang jadi makin turun jadi deh inflasi kaya di zimbabwe mereka beli telur aja bawa uang koper
80,harga telur naik pakan juga naik sekali telur turun hargapakan ngak ikut turun
81,protes harga turun peternak di magetan bagikan telur cumacuma
82,sementara harga telur bergulir turun terus sampai heran itu telur ayam beneran ngga ya heee
83,dalam bbrp hr ini memantau harga telur yg lg turun trus liat ada harga termurah kg lgsg beli deh
84,harusnya bersyukur harga telur turun kalau harga naik berarti ada inflasi kasihan juga rakyat kalau harga telur terlalu tinggi
85,artikel ini ga menjawab apa yang menjadi penyebab harga telur turun secara sederhana harga itu adalah kesetimbangan antara permintaan dan pasokan kalo harga turun berarti ada kelebihan pasokan danatau penurunan permintaan
86,mungkin nanti kalo bpnt nya triwulan uda jalan dan mulai pake telor harga lak merangkak naik dkit ini karna permintaan yg harusnya rutin perbulan lagi turun sedangkan yg panen banyak ga bisa jual karna pasar jenuh
87,lmajang priyo nina stmj maryadi harga telur turun jd rb ton jt rupiah berapa orang peternak yg menyedekahkan telur sebanyak ton kalau harga stabil berapa keuntungan peternak konsumen membeli telur dg harga mahal hampir sepanjang tahun bagaimanapun pedagang telur yg untung
88,kemarin harga jagung turun karena peternak ayam rugi sekarang giliran telor ntar harga apa yng akan di turuninbentar lgi harga cabe melonjak dan harga beras terjun bebassebenarnya pemerintah apa warganya yng gobloq
89,aksi bagi telur oleh peternak di dilatarbelakangi harga telur yang terus turun hari ini aliansi peternak di berduyunduyun baca selengkapnya
90,nasi masak sendiri beli telur skrg lg turun harga bgt sekilo bs buat seminggu
91,pemerintah jokowi memastikan bahwa pakan jagung ke perusahaan pakan berjalan normal ini sebagai jawaban untuk permasalahan pakan ternak ayam yg naik kali lipat sedangkan harga telur turun
92,bandung harga telur ayam turun akibat pakan jagungmurah
93,nagawa biasanya emang segitu sih paling turun pun cmn kisaran rb rb doang ini di kota malang sih demand telur disini masi banyak kalik makanya harga nya normal aja
94,mungkinkah karena harga telur di prancis lagi turun
95,riverheaven mafianya adalah produsen pakan ternakprodusen itu memonopoli semua habitat peternakan dari pakan induk ayam dan bibit ayamnya semua dimainkan oleh produsen pakan itu mau harga telur turun yaah harga pakan dinaikkan sehingga peternak kelojotanmummet to
96,asli dalam sebulan harga telur turun drastis
97,demam oooh demam kenapa kau tak ikut tren harga telur turun hiyaaaa
98,harga telur tuh emang biasanya naik turun tiap hari malah tapi biasanya antar kkkg dan ya murah banget apa stok telur nasional lagi banyak
99,harga telur dan daging ayam jakarta turun karena pasokan melimpah
100,pak mau ngeluh krn calon suami gk bisa jual telur krn harganya naik turun tidak jelas pasar nya kadang ada kadang engga istana negara mau beli telur produksi peternakan kami gak yaaa lumayan buat dapur istana pak ambil harga produsen gpp pak
101,harga telor turun tp bentukannya kecil bgt kea peluang dapetin dia
102,pasokan melimpah harga telur dan daging ayam jakartaturun
103,harga telur amp daging ayam turun
104,harga daging ayam potong turun telor turun knp pete tetap stagnan
105,daftar harga kebutuhan pokok jabar akhir september telur ayam dan bawang merah kembali turun
106,kasian bgt peternak ayam harga telur lg turun bgt
107,harga telur dan ayam potong di aceh turun
108,petani menjerit harga jagung turun pupuk langkah dan mahal peptisidah kuli harga naik pengolaan tanah gak maksimal kuwalitas pertanian jelek malah pak suroto gara telur malah ingin harga jagung turun cobak tanem sendiri aja rasakan jadi petani yang lahan sempit
109,iyakan orang mah udh ributin harga telor knp turun eh dia mah masih aja ngurusin iph user enak banget beban hidupnya ributin begituan doang
110,sebagai peternak ayam petelur harga jagung turun jg bukan solusi terbaik krn mslh peternak itu lbh kompleks daripada sekedar jagung mahal mgkn winwin solution antara petani amp peternak adlh biarkan jagung ttp harga rb tp telur yg harganya dikontrol biar bisa naik rb
111,kondisi skrg yg bingung pedagang warung belanja mgg lalu rbkg jual rb stok masih byk ada pembeli bilang harga telur turun di pasar rbkg
112,ini harga telur mirip harga saham hitungan jam bisa naik bisa turun
113,dgnputra harga pakan jagung naik kok bisa ya harga telur turun gw msh bingung cara ngitungnya
114,dgnputra dari dulu kan gw bilang om harga ayam naik telur akan turun klo harga ayam turunharga telor akan turun
115,harga telur ayam negri hari ini tembus harga terendah di tingkat pengecer kg akan semakin turun kah esok hari
116,harga telur turun drastis karena kebanyakan penduduk pria
117,antara bungah dan susah harga telor semakin turun sementara masihkah para wirausaha peternak ayam petelor bisa menikmati marjin keuntungan dengan jenak semoga mereka tetap semangat gusti allah swt ora nate sare
118,harga telor sekilo turun jd rb gils tahun lalu pas awal nikah harga telor sekilo sempet nembus rb
119,aku penjual telur ya yg aku heran pas harga turun itu yg beli sedikit tpi pas harganya tinggi itu banyak yg beli
120,biarkan harga jagung menaik hal itu cuma satahun sekali harga telor menaik pada diamharga telor turun teriak petani kalah terus
121,adem bgt ada tweet kayak gini btw harga telur sama daging ayam lagi turun dibeliin ini aja beliau senengnya luar biasa
122,harga telur setiap hari emang naik turun kak dan sekarang para peternak lagi ada dititik suram harga telur stuck rendah sedangkan harga pakan semakin melangit fyi ortu aku peternak ayam telur
123,harga telur eceran di pinggir jalan perkilo tiap hari berubah hari ini tulisannya besok naik jadi abis itu turun jadi berasa liat harga saham yang naik turun wkwk
124,gmna bu eko kenapa harga telur turun
125,ya allah bener banget harga telor di tasik sekarang aja bener bener turun banget gimana mau balik modal coba guee
126,ini masa yang ckup sulit selama saya beternak telor dimna harga pakan terus naik harga telor terus turun
127,kalaupun harga jagung sudah turun sesuai permintaan pak presiden belum tentu harga telur ikut naik karena ya kembali lagi kalau daya beli pasar masih rendah karena sebagian kota besar masih di berlakukan ppkm
128,sejak tugas pergi beli ikan sayur ayam ni tahu le jugak harga market pasaran telur pun satu naik turun tk leh member kdg murah kdg mahal
129,sedangkan harga telur ayam justru turun drastis
130,peternak bersekala kecil kemungkinan besar banyak yang akan gulung tikar kalo seperti sekarang ini harga pakan naik dan harga jual telur turun gak seimbang kok bisa seprti ini konsumsi masyarakat menurun karna covid blt dari pemerintah yang memberi beras langsung
131,di indonesia harga telor ayam ayam sunda ayam betawi ayam jawa semua turun harga sampai penternak mengeloh stok berlambak makan tak habis kredit ir jebat legends
132,ibuk cerita harga telur turun
133,akhirnya harga telur turun ayo pemerintah turun kan harga sembako lainnya
134,awal pandemi tahun lalu mas abis itu ya naik turun ga stabil paling parah bulan terakhir harga pakan naik efek langkanya jagung dan harga telur jauh dibawah harga produksi
135,info buibu harga telur lagi turun per kg
136,pemkab magetan udah ada gerakan beli dan sedekah telur harga telur malah turun tipis dua tiga september empat belas ribu limaratus
137,meski harga turun telur masih sepi pembeli
138,dalam dua pekan harga telur turun rp ribukg harian momentum
139,harga telur terus turun di jatim ketua dpw psi jatim harusnya negara melakukanintervensi
140,kng sy bangkrut minggu ini minggu dpn udh gak bs byr pakan harga pakan naik prod sama harga telur turun sudah berbulanbulan ini pake uang org lain buat nombokin pakan skrg cash nya sudah habis kira gmn ya kang punteun ironi peternak kecil
141,kalian semua mumpung harga telor lg turun pada beli dehh nnt naik lagi ke kan bedanya jauh bgt sm yg skrg lg wkwk
142,omg harga telur emang lg turun guys
143,harga jagung di tingkat petani itu sudah pas karna pupuk yg digunakan pupuk non subsidi kalo di minta turun lagi ya tekorlah petaninya kan masalahnya di harga telur yg turun kenapa harga jagung yg di salahin kalo gak kuat beli jagung ya di kurangi aja ternaknya
144,lucunya digit followersku bisa naik turun dh kyak harga telor ja naik turun
145,suroto peternak ayam asal blitar melakukan aksi protesnya kepada presiden jokowi soal mahalnya harga jagung membuat merugi karena harga telur anjlok bisakah harga jagung turun dan bagaimana nasib para peternak simak indonesia business forum jam wib di tvone
146,suroto peternak ayam asal blitar melakukan aksi protesnya kepada presiden jokowi soal mahalnya harga jagung membuat merugi karena harga telur anjlok bisakah harga jagung turun dan bagaimana nasib para peternak simak indonesia business forum jam wib di tvone
147,suroto peternak ayam asal blitar melakukan aksi protesnya kepada presiden jokowi soal mahalnya harga jagung membuat merugi karena harga telur anjlok bisakah harga jagung turun dan bagaimana nasib para peternak simak indonesia business forum jam wib di tvone
148,saat ini harga telur ayam turun hingga rp per kilogramnya
149,harga telur turun pakan naik peternak ayam ponorogo menjerit
150,suroto peternak ayam asal blitar melakukan aksi protesnya kepada presiden jokowi soal mahalnya harga jagung membuat merugi karena harga telur anjlok bisakah harga jagung turun dan bagaimana nasib para peternak simak indonesia business forum jam wib di tvone
151,boro diskon besaran harga daging ayam tomat sama telor agak murah aja udah seneng padahal ya paling turun ribuan
152,harga telur ayam ras turundrastis
153,jagung mmg blom masa panen jdi harganya masih lumayan mahal kg di tambah lagi belom banyak orang punya hajat jdi belum banyak telur yg terjual akhirnya stock melimpah otomatis harga turun
154,pak suroto kmrn di kompas tv bilang telur hrgnya turun lg bla bla bla pdhll sdh dibantu pak dikasih jagung gratis msh ngeluh inovasi dong biar untung jgn jagung srh turun harga ibarat dia ga bs berenang dikolamairnya minta dikuras
155,sobat harga telur hari ini turun cek info harga komoditi lainnya
156,ini pertenak ggk bersyukurharga telur ggk turun wouy
157,harga telur naik turun itu hal yang biasa
158,harga telur ayam ras di pasar sindangkasih kecamatan cigasong kabupaten majalengka jawa barat turun selama beberapa pekan terakhir
159,ini harga telur ayam di lotte grosir meruya terbaru turun tuh dari kg menjadi kg
160,harga telur ayam ras di pasar sindangkasih kecamatan cigasong kabupaten majalengka jawa barat turun selama beberapa pekan terakhir
161,harga pakan kan dari jagung juga nunggu panen jagung atau tanam jagung yg banyak nanti gantian petani jagung berontak tadi masalahnya harga telor turun merembet ke harga pakan ke jagung akhirnya
162,apakah mungkin produksi telur secara nasional surplus bang sehingga barang melimpah jadi harga bisa jadi turun hukum ekonomi gitu bang
163,dampak ppkm harga telur ayam turun drastis rp per kg
164,padahal harga telur di super market tinggi menurutku saya suka makan telur jd sering beli telur mohon perhatikan ini soal harga telur jgn sampai rakyat peternak rugi apa masalahnya knp harga telur terjun bebas segera diatasi jangan apa harus presiden yg turun
165,harga telur turun pemkab sidrap gelar rapatkoordinasi
166,saya tahun terakhir belajar jadi peternak ayam kampung telur dan bebek telur susahnya ampun menyiasati pakan yang harganya selalu naik anehnya harga telur turun saya rasa pemerintah mengendalikan harga pakan akan lebih solutip biar peternak pemula ga kapok jadi peternak
167,peternak ayam di kabupaten blitar jawa timur mengeluhkan harga telur ayam yang semakin turun menjadi hanya rp per kilogram sebab tidak sesuai dengan biaya perawatan
168,id emak ga ngerti politik emak taunya harga telor lagi turun harga jagung lagi naik terus suka bandingin harga di ecommerce yang penting masih bisa nemuin penjual yg jualan harga murah atau bisa ditawar udah gitu aja
169,ko aku seneng harga telur turun ya abisnya kemarin mahal bgt
170,peternak ayam keluhkan harga telur terus turun
171,siregar harga telur turun tapi tetap gak lakuartinya daya beli menurun
172,peternak ayam di kabupaten blitar mengeluhkan harga telur ayam yang makin turun seharga rp per kilogram pada senin
173,peternak ayam di blitar keluhkan harga telur semakin turun
174,nasib peternak ayam petelur belum membaik harga telur masih turun sementara jagung pakan ternak tetap mahal
175,setelah harga telur turun kini giliran harga ayam kampung anjlok
176,nasib para peternak ayam di kabupaten blitar jawa timur belum berubah meski sudah diundang presiden jokowi pada rabu harga telur ayam semakin turun dan pakan tetap mahal
177,nasib para peternak ayam di kabupaten blitar jawa timur belum berubah meski sudah diundang presiden jokowi pada rabu harga telur ayam semakin turun dan pakan tetap mahal
178,harga telur turun pemkab sidrap rakor cari solusi
179,peternak ayam di blitar keluhkan harga telur semakin turun
180,aja hari ini sudahulai turun dari ke marin asosiasi peternak di pimpin pak dpr mas sing ketemu pakde diseakati harga sebenarnya tiap thun tren sama juli sept jagung naik ini kata pedagang jagung dah expert masalahnya bep telor hari ini dari kandang
181,telur ayam turun nyampe kg perhari inisebelum bansos jokowi turun harganya agak tinggi sekitar kg jadi efek dibeli oleh pemerintah stok nya jadi abisyang mengakibatkan stok ke pedagang jadi sedikit dan harga yang melonjak naik well bansos tu nya banyak
182,jadinya harga telur jatuh trus untuk efisiensi jd protes harga jagung jagung banyak dibutuhkan di industri lainnya bukan hanya ayam saja kalo emang ngerasa berat beli jagung ya diganti dedek gitu buat makan ayamnya gw ga kebayang sih kalo sampai harga jagung jd turun bgt
183,daftar harga kebutuhan pokok jabar pekan ini senin september daging dan telur ayam turun
184,daftar harga kebutuhan pokok jabar pekan ini senin september daging dan telur ayam turun
185,sampe sekarang gua gatau apa faktor yang bikin harga telor naik turun yang gua tau ketika telor murah demand telor di kota kota besar berkurang jd telor menyebar deh ke daerah daerah gitu sih menurut analisa bodoh gua tp ga rebu juga kali turunnya hmm
186,harga telor anjlok banyak peternak gultik terus mau siapa lg yg ternak kalo yg ada aja bangkrut sedangkan harga pakan stay bahkan naik tp harga jual naik turun dan banyakan turunnya mau makan mie pake apa kalo gaada telor what business
187,sebagai seorang perempuan yang suka heboh sendiri kalo liat bulan langit lah pokok sama kalo liat harga telor turun need this day
188,harga telor turun biasanya sekarang cuma bisa bentuk tubuh maksimal kalo kayak ini asupan protein tinggi dah
189,telur tiap hari lagi mumpunh turun harga telur
190,cerita sama om tadi malam mengeluh harga gabah dan telur yang turun mengsedih iya tpi nda bisaki apa
191,harga telor turun harga martabak special masih ribu
