,tweet
372,covid konsumsi pasar menurun harga pakan naik harga telur turun apalah daya peternak rakyat ini
373,tobat ach giii uq sekarang gw tanya sama lu harga kangkung cabe telor apa naik lipat dengan status negara ini turun sekelas timor leste apa pengaruhnya buat kehidupan lu sehari
374,soalnya aku lagi ngangur ci apalagi pandemi takut cari kerja apalagi lulusan sma adanya garment disini terus kebetulan aku pelihara ayam petelur juga harga telur naik turun tp lebih sering turun jd pengen muterin otak kebetulan juga ak suka sama rotiantp masih bingung
375,hamzah yang lebih miris adalah ketika harga jual telur yg terus turun sedangkan harga pakannya terus naik tentu tidak akan ucuk jika mengacu pada biaya perawatan sia ayam
376,harga telur lagi turun kek nya
377,sukandar pesen buat japfa kalau harga telur turun harga pakan juga turun
378,harga ayam turun hari ini rb tapi harga bawang merah ugalugalan rbcabe rawit rbtomat rb bawang putih rbtelur rb harga sembako bumbu kalau naik membuat hatiku patah tapi kalau harga make up yg naik aku bodo amat
379,qiraniayr harga telor turun harga minyak turun pemimpin gak bisa mimpin ayooo turun
380,di jakbar juga segitu tadi ngelewatin agen sekilo harga telur emang fluktuatif bgt sih kalau naik bisa di atas kalau turun kadang sekilo bisa
381,haihhh bile lah telur nak turun harga dah bulan tak makan telur
382,teman pernah jd agen telur baru tahu tenyata harga dihitung perjam dr peternakan jateng smp jakarta maks jam lbh dr itu harga turun pantesan colt diesel telur larinya gilaan
383,koko tapi tolong pemerintah bisa kendalikan harga telur yg dari semenjak sebelum lebaran harganya gak pernah turun sampe di bawah rprbkg
384,tahniah kerajaan malaysia jangan jadi sejarah puak bulan duluharga telur turun senriuh sekampong cap ayam punya gomen
385,harga harga di negara harga pisang terangkat naik harga kacang terjepit harga telor naik turun harga susu seimbang yg penting harga diri terpelihara
386,eeee harga telor turun lagi
387,yoiii tergantung merk sm barangnya apa ka dan kondisi pasarnya gmn intan nemu tukang telor rbkg dimari even harga telor juga lg turun tp itu toko paling murah dr semua toko yg intan udh surpei wkwkw
388,udah turun lagi aja harga telor
389,harga jual telur di peternak cenderung turun
390,harga jual telur di peternak cenderung turun
391,standar nder harga telur lagi mahal dari setelah lebaran susah turun harganya
392,sabtu pagi bb kg minggu malem bb ini bb apa harga telor naek turun cantik wkwkwkw
393,winarno harga sandal turunharga celana melorot tajamharga telur tergantung
394,update daftar harga bahan pangan di di yogyakarta cabai turun hingga telur alami kenaikan via
395,tolak ppn sembako bayangkan beras misal harga rbkgppn bisa rb telur sekarang rbkgppn bisa rb minyak goreng rbppn bisa rb rakyat kecil bisa susah ini pendapatan turun pengeluaran bertambah apalagi kalau jadi ppn pendidikan juga
396,harga telur naik turun masyarakat resah itu baru satu item
397,army boscang jruk kangmasmo okeh ubi sama telor bisa turun harga
398,gak dipajaki aja harga telur naikturun dipajaki lg bisa naik terus gak turun
399,harga pisang slalu turun naik harga kacang terjepit harga susu membumbung tinggi harga telur tergantung
400,aku jarang deeptalk soalnya otak ku suka meledup kalau bahas yg beratyang dibahas harga nasi kuning mulai naik di sekitar rumah semula jd trs turun lg katau sekedar masak telor kegosongan sama masak air sampe asat
401,heboh harga porsi mie instan pakai telur rp ribu di puncak bogor camat turun tangan klik selengkapnya gt
402,heboh harga porsi mie instan pakai telur rp ribu di puncak bogor camat turun tangan
403,namun anehnya ketika harga pakan naik harga daging ayam dan telur justru turun sehingga berakibat hampir peternak rakyat gulung tikar duhh kacau lah yaa kirakira siapa ya yang mainkan harga
404,issully jadi gini jadi masalahnya saham turun ya jadi maaf ya kalo yg lain seneng krna itu pas gfriend diputusin mau putus contract dan gua tau kalo saham turun itu aj kecil bngt dan we astaga dia ga bahas gfriend disamain harga kek gitu dan dimananya coba bahas ma telur asin
405,kalo gantiin mah murah yakan telor harga turunbersihin ny itu amisnya
406,tiap tahun harga naik tidak pernah turun berarti sudah harga telur dll melambung tinggi tanya idul fitri ke alquran jangan ke agama lain atau hasil translete bahasa lain qo jd lebaran klo nanya bahasa sunda sama orang sunda begitu jg dengan bahasa alquran jgn semena
407,menjelang lebaran kenapa harga telur selalu turun ya mas
408,bila harga telur nak turun ni biji won paling murah harga bawang dah turun
409,harga gula naik ayam naik daging naik cabe bawang telur apalagi yang turun cuma susu jokes orang banjar jar
410,buset org pada gila gila amat ya harga telur turun telurnya dibuangin harga tomat turun tomatnya dibuangin kalo tbtb nanti harganya naik tp stock lu udh abis apa ga nyesel lu anjir
411,setau gw nih kalo ayam broiler stabil sih beda sama yg ayam petelur yg pakannya naik terus harganya tapi harga telur sering turun yg bikin rugi ya itu
412,serem euy kalau harga telur ayam ras sampai melonjak alhamdulillah stabil turun malah
413,ah ya sekadar intermezzo harga telur ayam ras di makassar hari ini stabil tweeps malah turun paksu beli telur rak harganya rp kemarin harganya rp rp semoga tetap stabil sampai hari raya eh dan seterusnya dong ya
414,kisah sukses kurniawan peternak millenial omset milyaran sukses bisnis ayam petelur di tengah kondisi sulit saat harga telur yg turun dan harga pakan sedang naik tapi ada secercah harapan yang patut kita jadikan inspirasi dari beliau ini simak di
415,ni la akibat bagi boomers perintah negara masing berat telur nak turun padang rakyat dah mengeluh harga barang naik melambung masih lagi nak aduan secara formal
416,emakemak harga daging naik terus nih telur turun
417,jelang lebaran harga telor ayam ras turun dikarenakan kurang pembeli
418,yakali suasana kayagini harga telur turun bunda bikin gemes bedug ajahhh
419,harga telur turunharga pakan naik apa tidak stres sekarang peternak
420,jelang lebaran harga daging ayam dan telur di kota semarang terpantau turun
421,jelang lebaran harga daging ayam dan telur di kota semarang terpantau turun
422,eh harga telur sekarang udah turun jadi rbkg loh
423,tanam jagung byak instead of durian so that harga telur daging dapat turun subsidi kepada melayan supaya byak hasil tangkapan laut gila ikan selayang rmkg selalu rmkg
424,tumben bgt bulan puasa gini harga telur malah turun biasanya naik
425,harga ayam potong dan telur turun di serang
426,pernah ga si mikir kalo bekicot tuh pengen jadi keledai belalang sembah kalo jadi manusia tetap menyembah ga kenapa ujan bisa turun padahal harga telor lagi naek ketidakjelasan sudah menjadi jalan ninjaku
427,harga cabe turun yang naik malah telor ahh
428,orang orang buka hape harga aset kripto turun saham pada merah ogut lewat kang sembako anjir hari lalu beli telor hari ini
429,dirumahku si harga telor kayak rate won ya naik turun teruss pernah minggu lalu paling mahal begituu ya dpt mayan banyak sii
430,politik telur naik berapa sen sen pun smpai musim perayaan ke pun tog la cakna wahai bank melayu jangan compare dgn najib bangga bila harga kangkung turun do better la day by day nampak la takde ilmiah pun self claim bijak politik bias ko tu kah kah kah
431,fadzil ouh ni yg menteri harga telur turun pun siap buat press conference eh lol
432,id bagi org kayai biarpun harga pisang naik turunharga telur menggantung ataupun hrg susu menggunung tak jadi persoalan lha bagi org miskin ya masalah
433,id agar kasih insentip peternak utk ngecilin telur sipaya harga bisa turun
434,harga cabai rawit merah sudah berangsur turun menjadi rpkg cabai merah keriting rpkg cabai merah besar rpkg per april sedangkan komoditas yang mengalami kenaikan adalah daging ayam ras dan telur ayam ras
435,harga daging ayam potong di sejumlah daerah di indonesia masih tinggi hingga saat inipadahal sejumlah komoditi pangan yang sempat melambung tinggi seperti cabai rawit dan telur ayam kini sudah turunnaiknya harga pakan ayam dan obat khusus ayam menjadi salah satu penyebabnya
436,tepung terigu naik telur ikut jugabahkan pada daging ayam negeri serta susu dan popok bayi terkerek ke leher well saya berharap harga rokok turun dan ini semua tidak baikbaik saja jayalah bangsa indonesia
437,kabar pasar pagi ini harga ayam potong udh turun jadi kg dsisi lain telur jadi kg semangat mamak ngelist menu yg ramah kantong tapi tetep bergizi
438,harga telur ayam ras di kota namlea turun di awal puasa
439,fadzil hang kata hang terar ha jawab la jawab mmm anyways barang asyik naik harga skrg prasan lak harga telur naik atau turun
440,menurut pedagang harga telur ayam memang selalu naik di awal ramadhan harga akan berangsur turun di pertengahan ramadhan
441,cuma cabai yang turun harga telur hingga daging di depok naik harga sejumlah kebutuhan pokok saat ramadan di kota depok jawa barat mengalami lonjakan harga di antaranya daging ayam daging sapi dan telur sedangkan untuk harga cabai relatif turun
442,tinjau stok dan harga bahan pokok jelang ramadan plt gubernur telur naik cabai turun via
443,harga telur ayam dan kepokmasturun
444,harga komoditas yang terpantau turun dibandingkan minggu lalu yaitu minyak goreng curah rpliter telur ayam ras rpkg serta cabe merah keriting rpkg
445,nkri harga mati harga kadrun turun draktis jual jasanya tak lalu lg sekarang mereka malah jualan telor di makasar dan di mabespolri
446,terpantau harga sejumlah bapok turun seperti minyak goreng curah rpliter bawang putih rpkg telur ayam ras rpkg daging ayam ras rpkg dan cabai merah keriting rpkg sementara minyak goreng kemasan terpantau rpliter
447,ri gmana harga ga naik om wong doc bibit ayam ekor plus harga pakan tembus ribu lebih peternak beralih ke ayam petelur eh harga telor yg turun klo turun lagi harga telor didemo lg sama peternak petelur hahaha
448,padahal harga telor lagi turun sekilo di bekasi hanya ribu
449,harga telur ayam di makassar merangkak turun jelang ramadan via id
450,harga telur ayam ras di makassar bergerak turun jelang ramadhan
451,harga telur ayam ras di makassar bergerak turun jelang ramadhan
452,harga telur ayam di makassar merangkak turun jelang ramadan
453,hmm ayam dan telur sih do harga naik karena demand naik harga naik akan membuat orang melihat ini investasi yang baik mudahnya kpr juga bisa menjadi penarik demand kuncinya tinggallah sama ortu selama itu memungkinkan biar demand semakin turun wkwk
454,harga telur turun jd rp ribukg ooh paskah
455,menjelang ramadan telur ayam turun harga smart listners memasuki awal bulan suci ramadan harga telur ayam di pasar tradisional kota bengkulu mengalami penurunan menurut pedagang hal itu dipengaruhi melimpahnya pasokan telur dari pe
456,harga telur ayam turun jelang ramadhan
457,harga telur ayam turun jelang ramadhan
458,menjelang ramadan telur ayam turun harga
459,harga sembako di kuansing jelang ramadan cabai turun telur ayam dan kacangkacangan naik
460,boumi abusafa harga telur kan naik turun
461,harga cabe telor bawang dan sembako aja naik turun masa harga pc stuck kan ga mungkin namanya juga makin banyak yg mau makin naik pasti
462,sdh turun yaa berarti harga telur
463,faktor yang menyebabkan turun nya harga telur dan solusinya bagaimana dokterharga telur turun kalau boleh tahu apa yang menyebabkan harga telur turun dan bagaimana solusinya dokter solikankendal solusinya dokter baca gratis di
464,iya naik turun kayak harga telur dipasar
465,minta solusi pak gub harga telur di jateng khusunya terus merosot turun pak tidak imbang dengan naiknya harga pakan yg sudah di angka karung
466,fluktuasi harga cabai rawit di jatim tinggi telur ayam cenderung turun
467,yg masalah harga paha turuntelur stabildada turun naik
468,alghozali hari ini ke pasar harga telur turun dibanding minggu lalu agak aneh sih krn kan skrg waktunya produksi kuker lebaran koq telur malah turun
469,harga minyak goreng naik telur turun
470,harga telur naik ke turun
471,harga telor rak turun lombok biji masih stabil rb bungkus bungkus isi
472,itu untuk telur ya kaa alfa suka naik turun klo harga telurr maaf kalo kurg jelas huhu
473,harga di alfanya kaa untuk telur suka naik turun gapasti
474,harga beras dan minyak meningkat jelang ramadan harga telur justru turun
475,kabar di jombang harga telur ayam dan beras turun
476,harga telur ayam ras di kota ambon turun
477,lebih kasian peternak lah jagung sekilo sedangkan harga telur turun
478,nanti aja deh nunggu harga telurnya turun hahahhaa soalnya pake telur lumayan banyak aku loyang bisa muat di oven kompor muat lebih banyak sih tapi hasilnya gak sesempurna pake oven listrik karna gada api atasnya
479,yant masih sama kok ga kaya harga telor naik turun mulu
480,jadi debat perkara telor aduh ini aldebaran lawak alfahri bangettt hahahahahahah harga dirimu turun al perkara mecahin telor
481,jelang ramadhan harga beberapa komoditi pangan mulai naiksebut saja cabai rawit telur ayam dan beberapa komoditi pangan lainnyadi solo harga telur ayam sudah mulai turun dari menjadi rupiah per kilogramnya namun harga telur di khawatirkan kembali naik
482,harga pakan ayam naik tinggi telurnya malah turun kan kasian peternak nya gw tau karena banyak yg tiba tiba mau jual peternakan ayam petelur modalnya habis nah si mafia yg permainkan harga nanti akan bebas jual telur dgn harga selangit masa gitu aja ngga bisa atasi nya
483,berita soal harga telor turun juga mane yaa dari marenmaren yg nongol beritanya kaesang putus ama pacar mulu
484,hahaha ye juga tu tapi harga telur turun naik setiap minggu biasa kalau murah terlajak tu stok lama la tu kaler pun dah pudar pudar
485,harga cabe naik telor naik minyak goreng naik brsyukurnya beras masih aman nyikapin kbutuhan dgn harga yg naik turun sy terpikir untuk cari donasi logistik mudahan minggu ini dpt donatur beras spy kuota gak turun saatnya lobi orang pasar bismillah
486,untung nino makan telor bukan makan tempe bisa turun harga lagi tuh si tempe abis di makan nino
487,permintaan sepi harga telur ayam kampung di padang turun
488,ditempatku pkh bantuannya kaya sembako buah telor ayam lele gitu dan dipegang orang yg ditunjuk dari pemerintah boleh milih mau ngambil yg mana gitu tp pokoknya tiap mau pkh turun tuh harga telor jd melonjak trs jadi jarang ada yg beli jg
489,wow dan trending ai apa tidak ada lagi berita yang nyatah untuk di up up harga telur per kg udah turun gaiz tapi cabe lombok masih mahal
490,id apa kabar harga cabe dan telur yg naik turun seperti roller coaster
491,tugu monas ada di jakartatugu kujang ada di bogorkaga perlu banyak harta mending banyakin stok telor harga telor turun kong aina perkilonya
492,harga telur udah turun
493,tu janji masa zaman ph masa zaman ph dah ambik elaun rasa nyer ada yang janji tak de tol harga minyak rm tapi harga telur pernah turun sen masa cny zaman ph lepas cny harga naik lebih sen
494,pantesan harga telor mentok di melulu turun seminggu eh minggu depan udh naik lagi
495,md official harga telor turun dengan bangga nya tapi takda kesan apa pun pada rakyat mcm takda fungsi menteri ph ni puiiiii blh pangkah jamban laa lepas nii
496,lets join around table money talks harga telor hari ini turun naikharga susu ibuibu kurang dihargaijanda berkeliaran mengurangi harga pasar yang dikuasi harga fluktuatif telor yang sepi dipasaran
497,umkm perasaan sekeliling bnk yg minta tulung tapi maaf blm bs bantu harga telur asin risky ttp bahan nya naik kebutuhan hdp turun jelas naik turun innalillahi wa innalillahi rojiun salah syst slrhnya ato kt salah dagangnya ya
498,madja ci besok telor turun harga ga
499,tfirdausi beras standar di angka telur naik turun pak haji tapi beda toko beda harga
500,min ini tokopedia emas eror apa emang kebijakan nya berubah yah masa harga jual emas lagi naik harga belinya turun banget gimana bisa cuan kalo gini
501,mirajkt jktteamt ci harga telur dah turun blom
502,harga telur minggu ini turun sih dibanding minggu kemarin se
503,harga telur malam ini turun banyak imbas jakarta banjir
504,makan di jogja itu murah sebelum gempa setelah itu harga naik dan gak turun lagi ttd pelanggan pecel telor rp
505,kompius lahbila harga ayam naikharga telur ayam turun bila harga ayam turunharga telur ayam pula naik cmne tu ada explanation
506,harga telur turun lira kuat lagi
507,harga telor naik turun
508,euy info dong harga telur masih turun atau udh naik lagi
509,jeballl bantu aku membahas harga telur yg sedang turun juseyo
510,pak harga telur puyuh kok turun terus belum lagi harga pakan naik terus minta tolong pak dibantu kita peternak puyuh
511,hahaha adadapat gaji beli laa brg rumahberas kaa telor kaakicap kaasabun kaahahahaafaham harga rumah xkan turuntpi xsalah duk rumah sewa or rumah secondklaw nk duk skli mentuakena taw laa adat menumpang walau tuan rumah beriya sgt sruh duk skli
512,harga telor di polat naik turun terus dynamic pricing ato simply sd aj tiap semester jg ngecekin harga susu dan barang di jumboah naik kok barang cent jd ya hmmm klaim kalo harga groceries ga naik di belanda jg tp mungkin govt controlled
513,harga telur ayam turun diperkirakan picu deflasi di februari viva
514,harga telur ayam turun diperkirakan picu deflasi di februari viva
515,aku ni hampir setiap harilah menghadap barang keperluan harian ni amp memang boleh tahu harga naik banyak ke turun sikit ke apa ke jadi kalau sembang harga kembali stabil buktikan sekarang telur yang sebelum pkp gred boleh dapat rm tapi sekarang rm
516,harga telur naik turun mulu deh
517,eh saham masi merah smua atau harga telur ayam ras lagi turun ya adalagi
518,karna harga telor juga naik turun
519,derita peternak ayam harga pakan naik harga jual telur turun
520,derita peternak ayam harga pakan naik harga jual telur turun
521,derita peternak ayam harga pakan naik harga jual telur turun
522,minyak zaman pn ni tak pernah turun ye naik manjang itu la cara nak amik balik duit dari rakyat tahniah kerajaan melayu isley walaun yg dok ratib dap babi smua skg snyp xnk bising dah otak dkt lutut harga barang naik pon menteri kpdnkk tak buat apa semua goyang telor je
523,harga telur ayam turun diperkirakan picu deflasi di februari
524,harga telur ayam turun diperkirakan picu deflasi di februari
525,harga telur ayam turun diperkirakan picu deflasi di februari
526,bm sedih sebab dah tak ade ph kalau tak telur dah turun harga sen masa cny lepas tu naik lebih lagi kejayaan terbesar masa zaman ph
527,harga telur dan daging ayam turun minggu pertama februari diwarnai deflasi
528,harga telur turun tak masa ph harga turun sen abaikan kenaikan lepas cny
529,follower naik turun kayak harga telor selamat siang selamat menjalankan ibadah sholat jumat bagi teman moeslem selamat maksi bagi yang sudah siap maksi salam damai sejahtera bagi kita semua
530,permintaan telur ayam turun sejak ppkm harga anjlok
531,sebagai warga biasa yg bukan pelaku pasar jika ingin mengetahui harga telor naik atau turun sangatlah mudah lihatlah sosmed teman peternak jika sepi status artinya harga telor naik tapi sebaliknya jika mereka rajin berkeluh kesah di sosmed artinya harga telor terjun bebas
532,harga telur turun sebaliknya harga pakan justru menanjak naik hal ini membuat para peternak telur buntung karena harga jual mereka tak bisa menutup ongkos produksi
533,suara merdeka harga telur di sleman anjlok permintaan turun akibat ptkm
534,tren harga telur ayam ras diprediksi turun hingga februari ini
535,harga telur turun harga pakan naik
536,harga telur turun peternak ayam merana
537,harga telur ayam turun merosot hingga rp ribu
538,harga telur ayam turun pedagang resah
539,tau gasi kalo harga mahal terus lama kelamaan gaada yg beli trus jadi deh harganya turun sama kek harga telur saat ini moga aja pc nct juga gitu ya aamiin hihi
540,harga telur turun banget pantesan tadi di pasar beli telur kirain uang kembaliannya kelebihan
541,masa iya jualan telor yg harganya fluktuatif disamain kaya judi atau jualan komoditas disamain kaya togel karena pola bulan tertentu harga naikturun misal kalo musim panen otomatis over supply harga jadi turun jadi kaya togel dong berpola
542,harga telor turun naik adalah hal biasa sebulan yg lalu harga telor masih ribu per peti isi kg baru minggu ini turun sedikit smpe ke rebu per peti besok jg harga akan kembali merangkak naik
543,harga telur yang turun sampai dibuang
544,disclaimer cepetan dibeli jokolor joko telor nya mumpung harga telor lagi turun
545,mohon ada usul trunkan harga telur mahal sangatlah telur skrang turun sen pun jadi lah
546,kementan sebut harga telur ayam akan turun sampai pertengahan februari
547,kementan perkirakan harga telur ayam akan turun hingga pertengahan februari
548,harga telur ayam bisa terus turun sampai kapan
549,pemerintah prediksi harga telur ayam terus turun sampai kapan
550,kementan proyeksikan harga telur ayam turun hingga pertengahan februari setelah itu
551,harga telur ayam turun daging sapi stabil
552,kementan harga telur ayam akan turun hingga pertengahan februari
553,kementan prediksi harga telur ayam akan turun hingga pertengahan februari kepala bidang harga pangan badan ketahanan pangan bkp kementan inti pertiwi mengatakan pemicu turunnya harga telur adalah produksi yang berlimpah namun tidak terserap
554,harga telur turun omzet pedagang di pasar kajen pekalongannaik
555,sy seneng harga telur turun jd tiap hari gak hanya makan tempetahu mulu tp kasihan jg peternak merugi disisi lain krn kondisi pandemi ini susah byk pembeli seneng hrg telur murah
556,emang ada yg peduli kalo harga telor terus turun videonya buang telur viral suparni minta maaf dan mengaku kecewa
557,harga telur ayam di kulonprogo menggelinding turun peternak terancam merugi
558,telur dekat mesir ni ikut harga emas ke tiap hari lain harga kejap naik kejap turun hmmm
559,harga telur ayam di kulonprogo menggelinding turun peternak terancam merugi
560,di gunungsindur bogor gw masih beli telor di kandang peti isi peti kg itu murah krn sebulan yg lalu harganya masih dikisaran peti tp ktk harga telor mahal telor laris manis tp giliran turun mlh kendor
561,tetap tenang meski makin hari makin kesini harga telor terus turun
562,harga telur ayam di kulonprogo menggelinding turun peternak terancam merugi
563,harga telur ayam turun tajam ini faktor pemicunya
564,kementan prediksi harga telur ayam bakal turun hingga akhir februari
565,anjloknya harga telur disebabkan karena serapan turun hingga persen termasuk di wilayah jabodetabek sampai bandung yang menyerap persen telur nasional
566,ini penyebab harga telur turun sampai peternak buang stoknya
567,ini tindakan salah besar harusnya yg dibuang bukan telor tapi ayamnya kan ayam yg ngabisin pakan yg mahal kan kalo nggak ada ayam harga telor nggak akan anjlok krn produksinya turun tul nggak
568,harga telur turun harga pakan naik
569,harga telur ayam meroket turunpeternak mengalami kerugian yitulah pusaran ekonomi kadang untung kadang rugi bagi para pelaku pasar
570,saat ini harga telur ayam di tingkat peternak secara nasional turun drastis menjadi rp rp per kilogram
571,habis baca koran katanya harga telur naik karena permintaan di pasar menurun peternak jadi susah karena harga pakan ayam naik jadi inget baru bulan lalu nenekku ngeluh harga telur naik banget dan mahal berarti dalam sebulan harga telur naik dan turun secara signifikan
572,kalo kata anak peternakan yg emng turun di peternakan tengkulak perusahaan korporat yg mainin harga pasar ketika stok telur melimpah kalau dijual kepasar bakalan turun harga makanya telurnya di keep walau ampe busuk ketimbang jual murah apalagi masa kaya gini juga pakan
573,harga telor turun konsumen riang peternak meriang tata niaga telor harus diatur agar peternak dpt untung konsumen tidak buntung
574,harga telur terus turun ribuan peternak terancam bangkrut
575,berita harga telur turun jadi rp ribu
576,semua mikirin dapur masing tidak ada lagi yg mikir soal gengsi rakyat belanja yg perlu aja sembako aja telor aja turun omset harga di konsumen terjun dari rp per kg ke rp peternak rugi harga pakan lebih mahal dari harga telor
577,mereka buang itu buat ngelampiasin doang aslinya mah byk juga yg dibagiin ke orang ya gimana ga kecewa sih harga telur turun sedangkan pakannya naik pesat
578,ini bentuk protes soalnya harga pakan mahal tapi harga telur turun
579,harga telur di jombang turun malah sepi pembeli
580,gw nemu ini di beranda fb gw belum tausi knp harga telor turun pendapat gw tntg video ini gak seharusnya dibuang kaya gitu ya walau harga turun ya dicobalah utk disedekahkan saja lebih baik dripda mubazir kaya gitu ya gasi ada yg pnya pendapat lain presiden jokowi
581,harga telur turun sebaliknya harga pakan justru menanjak naik hal ini membuat para peternak telur buntung karena harga jual mereka tak bisa menutup ongkos produksi
582,ya karna bahan baku untuk konsentrat ayamnnya naik mbk jadi harga pakan nya naik sedangkan harga telur merosot turun semenjak dilakukan kembali psbb jawa bali mungkin kalau peternak gak bisa atur keuangan saat ini bisa gulung tikar mbk
583,harga telur ayam ras diperkirakan terus turun setidaknya sampai akhir februari akibat pasokan melimpah dan tak diiringi serapan optimal via
584,viral orang magetan membuang telor ayam karena harga turun sementara harga pakan naik dalam menjaga keseimbangan pasar contohlah cina over produksi yang tidak diserap oleh pasar di export keluar shgg harga terjaga stabil pemerintah bantu
585,telur turun hargadi maluku mahalnya minta ampun
586,protes buang telurharga naek deh emak langsung demo ke pemerintahturun lagi protes laginaik demoturun ngga kelar
587,gatubitu produsen telor ayam kayaknya ga terima sm harga telor yg turun trs tp harga pakan makin naik soalnya kayaknya indeks harganya supply demand kl supplygtdemand pasti harganya makin murah
588,rek harga telur turun ta
