,tweet
589,aksi peternak membuang telur ayam di magetan karena kecewa harga telur ayam turun terus dan kini ia meminta maaf
590,sambil terus membuang telur tersebut ke sawah suparni mengeluhkan harga telur yang turun setiap hari
591,peternak telur mengamuk harga telur turun drastis
592,tapi telur kalau disimpan sampai harga naik keburu busuk kalau bagi bagi gratis lah kasihan peternak telur lain demand pasarnya dipenuhi sama telur gratis udah harga turun tambah lagi ini bagi bagi telur gratis serba salah memang jadinya
593,sambil terus membuang telur tersebut ke sawah suparni mengeluhkan harga telur yang turun setiap hari
594,aksi peternak membuang telur ayamdi magetan karena kecewa harga telur ayam turun terus kini ia meminta maaf
595,yg gak punya empati sama rakyat siapa bunda jelas disini saya lebih suka harga telur turun biar rakyat kecil seperti saya masih sanggup beli untuk jd sumber protein setiap hari mereka mah yg punya ternak udah biasa makan mewah masa sesekali gk mau rugi demi rakyat kecil
596,katanya pakan buat ternak telur naik sementara harga telur turun terus
597,harga telur ayam turun drastis
598,harga telur turun protes apalagi harga telur naikpemerintah gk pro rakyat sebagian rakyat wkwkwk
599,bisa dibikin cake yg perlu banyak telur nanti dibagi bagiin ke orang yg turun harga cake bukan telur
600,iyap kalau tukang kue seneng pas harga telur turun plus minus ya namanya juga orang dagang
601,harga telur ayam ras diperkirakan terus turun setidaknya sampai akhir februari akibat pasokan melimpah yang tak diiringi dengan serapan optimal artikel asli dimuat di mitra teras suaraindo
602,bisa jd dan juga sekarang didaerah rata harga telur akan naik menjelang pembagian bantuan non tunai setelah itu turun lg yg punya akses kesana fine sj yg ngga ya mumet
603,ada aksi peternak membuang telur ayam di magetan karena kecewa harga telur ayam terus turun setelah videonya viral ia meminta maaf
604,telur mahal banget padahal dari kemarin belom turun sama kek harga ayam
605,liat berita ada pedagang telur atau peternak apalah itu kesal karena harga jual telur turun terus dia buang itu telurnya astaga bapak kalo kesal jangan merugikan diri sendiri juga dong itu telur dibuang gitu aja padahal bisa jadi duit
606,kesal harga telur terus turun pria ini buang ribuan telur ke sawah lewat
607,kementerian pertanian prediksi harga telur turun sampai akhir februari
608,sy kecewa harga telur terus turun sy mhn maaf amp janji tdk kan mengulangi video yg tdk pantas ini suparni minggu maaf diterima tp proses hkm tetap lanjut polri setdknya pencemaran lingkungan amp spy jgn terbiasa arogan dgn kesombongannya
609,harga turun peternak buang telurduhh kasih aja sih ke oranglebih faedah
610,mbak bukan ribut tp pas beli dari peternak harga masih tinggi jadi klau harga telur turun ya otomatis sedikit untungnya positif thinking aja
611,da aksi peternak membuang telur ayam di magetan ia kesal karena harga telur ayam turun terus
612,mustofa daerah lain kan punya supplier juga kalo daerah lain demandnta tetap supplynya ditambahin gmn harganya turun supplier daerah sana pasti ga mau kan dibuang gitu ga langsung bikin stabil harga tapi mencegah demandnya turun karena kebanyakan telur dijual murah
613,coba berpikir jernih dikit ini protes ke siapa klo percaya alloh tuhan mengapa takut mendermakan telornya sebel kok sombong amir telor dibuang dibagiin trus harga turun tapi dapat pahala rejeki bisa datang dari pintu lain
614,pria bernama sukarni kesal karena harga telur ayam turun terus namun harga pakan ayam malah naik akhirnya telur ayamnya dibuangbuang
615,setelah baca replynya katanya biar jaga harga gak turun lg disaat harga pakannya naik yaa at least dijadiin makanan olahan kek frozen telor godog kek
616,emosi lantaran harga turun peternak di magetan buangbuang telur ke kebun fokus
617,harga telur ayam ras diperkirakan terus turun setidaknya sampai akhir februari akibat pasokan melimpah yang tak diiringi dengan serapan optimal
618,ketimbang dibuang percuma kenapa nggak untuk dibuat kue aja toh harga kue nggak turun kok aku sedih kalo liet telor segitu banyaknya dibuangbuang
619,di kalimantan harga telur ga turun
620,mei telur harga turun suruh bini dia bikin kue trus jualin gubluk amat ilmu ekonomi praktisnya
621,luapkan emosi karena harga jual turun peternak ayam di magetan buangbuang ratusan telur ke kebun padahal kalau disumbangin aja bisa lebih bermanfaat ya berita lainnya
622,sebagai peternak amatir dampak ini juga terasa harga telur turun harga pakan naik bahkan di puyuh naik hingga per karung sedang harga telor anjlok sampe per kg jadi pengen bikin pabrik pakan dah
623,oh makanya kemarin harga telor turun pertanda bentar lagi naik lagi nih
624,mei pekok giliran harga telor turun protes giliran harga selangit gak perduli dengar sekitarnya
625,ktika ada berita seorang petani membuang semua telur ayam yg baru dipanen karna menurut beliau harga pakan terus naik namun harga telur turun netijen mnyet beramai menghujat tanpa pernah mendalami bahwa isu pupuk dan pakan naik menjadi momok bgi petani
626,ya mo gimana kalo harga telor lagi turun trus malah dibagi bagi trus tar yg beli siapa makin anjlok dong kalo bisa nyuruh ayamnya mogok nelor juga udh disuruh mogok nelor keknya wkwk
627,viral video buang ratusan telur ke sawah peternak ini diduga kecewa harga jual turun
628,im itu hanya bermaksud memprofokasi kita smua tahu harga telur naik turun sesuai kesediaan barang dan kebutuhan ada kalanya tinggi selangit dan aku jg gk yakin dia peternak
629,harga telur ayam ras diperkirakan terus turun setidaknya sampai akhir februari akibat pasokan melimpah dan tak diiringi serapan optimal
630,miris kelakuan manusia ini spt tidak beradab disedekahkan lebih manfa at kalau rugi overacting kalau untung diem pd hal harga telur itu naik turun kok sombong nya keter laluan lagi pula akan menyebarkan bau busuk biar di protes warga se kitarnya
631,pantes kmrn pas belanja liat harga telur turun
632,harga telur hancur kmren beli di pasar normal ja beli yg dah matang di warung makan jg harganya gk turun
633,protes kesiapa sesama peternak ayam petelur dimana kalo panen raya hrga turun mas ga cuma telur sayur buah dll dpt harga jual bagus kipas senyum tp pas dpt hrg anjlok merasa paling terzolimi yaowohh sadaro mas
634,harga telur turun harusnya harga air jordan juga turun
635,nggak membenarkan videonya tp membenarkan caption nya alias harga pakan melambung tinggi karena barang langka tp harga telur turun
636,harga telur turun rakyat senang peternaknya marah harga telur naik rakyat marah peternaknya senang berlaku untuk semua bahan makanan ehh iya ga sih begitu
637,suni sederhananya gini bang kalo telur dijual murah otomatis orang beli dan udah makan telur nih trs abis itu permintaan telur turun nah permintaan turun harga ikut turun gitu seterusnya biar harga naik gmn ya harus meningkatkan permintaan caranya gmn
638,armayanto mei aki jadi seudzon jangan dia spekulan telur ayam numpuk stok agar harga naik lalu jual mahal eh ternyata sampai busuk harga malah makin turun
639,confuse ya dsatu sisi harga telur turun konsumen seneng tp dsisi lain pedagang telur mengeluh amp lbh memilih membuang stok telur buat menstabilkan hrga
640,harga telor turun dimana disini naik mulu ya allah udah bagus turun eh sekarang naik lagi ulah siapakah itu astaghfirullah hal adzim
641,telor mah tiap hari juga harga nya berubah hari ini naik hari juga turun drastis udah kayak saham mak gw tiap jam pagi pagi siang sore ampe jam malem itu pasti nelfon nanya harga minyak juga gitu cie anak bandar bgt gw but im proud
642,kecewa harga telur turun terus hingga rugi sedangkan harga pakan naik terus pengusaha ini buang telur ada yg sarankan sumbangkan dumping ini sdh benar klu ada bbrp pengusaha musnahkan serentak maka supply di pasar menurun amp harga telur merangkak naik
643,gue sehari makan telur kalikan sebulan udah hampir rbuan ya ampun itu ribuan telur klo di rupiahin jadi berapa mau katanya tujuan utama dia demi kebaikan dan supaya harga pasar gak turun sama aja goblok
644,harga telur naik dan mahal diyem ae giliran turun ribut mbok dijual murah bila rugipun paling tidak ada duit masuk juga membantu mereka yg sekarang susah bisa dapat telur murah kan berkat orang tidak tau bersyukur ini berkat disiakan
645,im aku mendukung mu pak buang semua saja ayamnya sekalian biar gak usah sibuk beri makan ayan bapaknya emosi karena pakan ayam terus naik tapi harga telur terus turun namanya emosi mana ada mikir untuk berbagi pikiranya sudah merugi
646,dewasa ini baru tau kalo harga telur ditentukan sama harga pakannya makanya naik turun
647,harga telur di kandang turun di warung kelontong nggak turun alasannya kulak dengan harga lama denger harga telur di kandang naik eh langsung dinaikin tuh harga di warung kelontong penikmat cuan dari telur selain peternak ada bakul dan warung ecer bila peternak bagibagi
648,denger ada ppkm ppkm gtgtgt cafe resto hotel omset turun gtgtgt demand telur turun gtgtgt telur over supply gtgtgt harga telur turun yang kena efek bukan cuma peternak pelaku ekonomi terdampak mmg sulit tp bijaksanalah berikan sama yang kelaparan sama ga dapet duit beda pahala
649,kalau misal cari ide bikin olahan telur kira gimana jd ngejual olahan telur mungkin bs nutup apalagi klo harga turun krn supply berlebih atau telur ini bs dijadikan pakan aja kira kira bisa ga ya
650,mei rasanya ini peternak baru klu peternak lama tau kalau harga pakan naik harga telur biasanya turun
651,sungguh sia sia perbuatanmu kisanak masih banyak korban banjir dan longsor yang membutuhkan banyak pengangguran phk yang buat makan keluarganya saja susah untuk membeli telur apalagi ayam mikir kaga sih mikirnya kecewa harga jual turun doang ya ya lu makan sendiri jg gpp
652,biar harga stabil karena stok telor banyak tapi pembeli dikit jadi harga makin turun katanya sih itu masuk ke hukum ekonomi baca di artikel jg selain telor ayamnya jg dimati matiin jadi stok ayam sama telornya sebanding sama pembli cmiiw
653,ak udh seneng harga telor turun dari ke
654,harga telur turun musiman sih biasanya mas
655,ehhh sini produksi telor terbesar di jatim kayanya tapi aku ga ada denger harga telor turun
656,ah paling itu pengusaha yg kalau telur naik beli pajero aku benci aja makanan di buang buang gitu benci aja kan bisa di bagikan lagian harga telur turun kan gak kali ini saja
657,jgn kesal pak kali aja harga telur turun bisa jadi langkah awal terjadinya deflasi di negara ini
658,la magetan suparni alias pitut akhirnya meminta maaf pada senin dia mengaku membuang telur ayamnya ke persawahan lantaran kecewa lantaran harga telur semakin turun sementara harga pakan terus menaik
659,yang jadi masalah bagi peternak adalah ketika harga telor turun tetapi harga pakan ayam terus naik itu yang sering di keluh kesahkan para peternak
660,keretakuda kurang paham dengan apa yang terjadi dengan orang itu masalahnya video tanpa narasi padahal harga telur biasa saja tidak turunturun banget
661,iya ci barusan aku baca sekilas katanya itu bentuk protes ke pemerintah soal impor telur yang bikin harga telur terus turun pemerintah juga ternyata pernah ngelakuin hal yang sama agar harga telur tetep stabil
662,im hmmmmmm suparni alias pitut akhirnya meminta maaf pada senin dia mengaku membuang telur ayamnya ke persawahan lantaran kecewa lantaran harga telur semakin turun sementara harga pakan terus menaik
663,saya sebage peternak ayam petelur kok merasa biasa saja ya bukankah harga telur naik turun itu biasa saja
664,aneh harga ayam naik tapi harga telur turun
665,subhanallahmending di sedekahkan dr pd buanghabya krn harga telur turunmsh banyak orang yg pengen makan dgn telur ga bisa beliastaghfirullahhabya krn pengen viral melakukan hal yg dimurkai allahwaliyadzubillah
666,mau disimpen terus juga storage penuhkrn ayam ngendog terus gak iso diremalhasil bosok mau dibagiin ke orang juga malah bikin harga makin turun spekulasi dibuat olahan telur juga butuh effort wis paling bener dibuang agar telur langkatrs harga naik
667,menurut hitungan peternak harusnya harga telur brp sekilonya ini baru mingguan harga telur baru turun ke kisaran rb sebelumnya dari awal desember harga telur naik bahkan sampai menyentuh rb sekilo
668,menurut hitungan petani telur harga telur itu harusnya di nominal brp bulan belakangan harga telur dipasar rata cukup tinggi dari biasanya naik turun di kisaran rbrb sedangkan di harga biasa kisaran rbrb barusan aku beli telur harga sekilo
669,kalau harga turun aja gimmick coba kalau pas harga naik diam juga mereka masih banyak masy yang belum mampu beli telur ini contoh buruk
670,mestinya kalo di kasiin telor nya nanti di kasih judul peternak telur kecewa harga telur ayam turun terus jadi di bagiin gratis mungkin bisa jd berkah
671,bkp prediksi harga telur bakal turun sampai akhir februari
672,harga telur ayam turun itu cobaanjawabnya sumbangin ke org yg tdk mampu bukannya malah dibuang
673,byk bgt yg blg mubazir ya emg tp kalo dibagiin org bakal trs mikir ah ga usa beli ntar jg dibagi telornya dan itu berlanjut trs demand turun supply tinggi harga makin jatuh pdhl buat dapetin telur itu butuh pakan ternak yg sayangnya hrgnya tinggi jd ngerugiin peternak
674,goblk klo harga telur turun terus dan lo buangin tu telur kan ruginya makin gede mending jual dgn harga pasar tpi sambil minta bantuan ke dinas terkait walaupun kecil kemungkinan di tanggapi pengalaman
675,di jawa telur dibuangbuang sama peternak telur dgn alasan harga yg terus turun coba sini kirim aja ke gw biar bisa bikin kue pake telur gratisan drpd di buangbuang gt kan
676,mgkn juga krn daya beli masyarakat akbt sedang turun shg suplai telur tidak terserap dgn baik smtr ayam bertelur terus dan butuh pakan ini terjadi di hampir semua produk konsumsi byk yg gulung tikar akbt mahalnya harga produksi multi dimensi memang semoga normal kembali
677,pernah naik tinggi harga telur ayam tidak pernah naik tinggi telur ayam turun berapa jauh harga telur ayam jika murah pasti ada pemborongnya telur ayam tsb
678,bapaknya ga mau ngasih gratis teh bisa harga telur turun drastis makanya dibuang
679,knp nga dikasi orang drpada dibuang ntar telur di pasartoko tmbh nga ada yg beliharga tmbh turun knp nga dijual ke lokasi lain yg harganya mahal krena butuh biaya transport itupun klo nemu pembeli tiap lokasi sdh pnya msg produsen
680,mei saatku mencari nafkahkadang msh sering kulihat orang dgn keterbatasan fisik mintabekerja apa saja demi sesuap nasijgnkan utk beli telur dagingbeli beras sja susahmknya nangis lihat org membuang telur hnya gara harga turun harga pakan naikkamunya mgkn krg bersyukur saja
681,solusinya klo mau asosiasi pedagang ayam petelur harus bersedia mengurangi jumlah ayamnya spy produksi telur bisa turun dan harga terkerek naik dgn jumlah ayam yg turun harga pakan ayam jg akan turun selanjutnya dibuat kesepakatan bersama ttg jumlah ayam pemda pengawasnya
682,ada aksi peternak di mabetan membuang telur ayam karena kecewa harga telur ayam turun terus kini ia meminta maaf
683,apa ini ngebuat harga telor jadi turun kemaren malem beli telor biasanya sekilo ini
684,terus arep dadi opo peternak pakan mundak terus endog soyo mudun dinyang murah tak guwak pisan terus mau jadi apa peternak harga pakan terus naik harga telur terus turun ditawar murah saya buang sekalian
685,ancur apanya di tempat gw harga telor kaga turun sebutir sekilo
686,harga telur di pati turun harga pakan malah naik
687,bego dipelihara ya gini dengan lu buang telur bakal berimbas apa turun ya jual turun untungnya kan udh lu dapet pas harga mahal
688,perbuatan biadap tidak ada sosial sama sekali kenapa mesti dibuang karena harga telor turun apah waktu harga telor tinggi loe mau bersedekah keuntungan
689,mereka kaya gituh mungkin harga telur lagi turun drastis jadi mereka kecewa dengan harga btw mungkin
690,kufur nikmat dibuang satu truk juga gak bakal naikin harga setiap hari saya makan telurkok harga malah turun rb
691,masih banyak orang yg tidak mampu makan telur kenapa harua dibuang kenapa gak dikasihkan orang yg membutuhkan gara harga telur turun lalu apakah harus dibuang banyak orang berjuang hanya untuk mendapatkan butir telur
692,rang orang jawa bilang harga telur turun aku yang telur beli sebiji gigit jari nasib idup di pulau
693,jualan di aceh aja di aceh ga turun harga telor
694,iya tapi kalau dibuang sebagian juga gapapa itu bentuk protes karena harga telur turun
695,harga telur kn turun skr jadi kg di sini
696,klarifikasi dari bapak yang lempar telur karena harga pakan naik terus sedangkan harga telur turun
697,jadi juragan telor harga naik turun itu memang resiko jualan kalau mau fair pembeli sempat dibuat kalang kabut saat harga telor naik sampai ribukg
698,astaghfirullah aladzim tempatku loh sepiring telur rb harga turun drmn
699,semangat boss semoga pemerintah atau dinas terkait bisa melek dengan situasi ini harga pakan naik harga telor turun permintaan pasar menurun
700,perlu penstabilan harga telor di pasaran dan tindakan lebih atau solusi lain dari harga pakan pabrikan yg terus naik peternak jg mengeluhkan bakul bakul telor yg tidak mengambil telor di saat harga turun membuat stock di kandang melimpah bahkan sampai minggu tidak diambil
701,ada aksi peternak membuang telur ayam di magetan ia kesal karena harga telur ayam turun terus
702,protes harga pakan naik terus tp harga telor turun
703,sebenarnya bukan kali ini saja harga telor turun tahun kemarin harga telor mencapai di kandangpeternak dan itu terjadi pada hari saja dan masyarakat berlomba lomba membeli telor di kandang dgn harga kandang
704,harga telor harian ditentukan dengan melihat harga telor di sejumlah wilayah kenapa harga telor turun sebenarnya sama saja teori ekonomi pada umumnya permintaan di pasaran sedikit dan stock telor melimpah sehingga menyebabkan harga telor anjlok
705,kecewa harga telur anjlok peternak ini lempar puluhan telur terus mau jadi apa peternak ini pakan naik terus harga harga telur terus turun masih ditawar murah daripada ditawar murah mending aku buang saja
706,duro harga telor turun say
707,harga telur turun dari mana sih perasaan di daerah rumah masih mahal aja
708,viral video peternak di magetan membuang telur ayam karena kecewa harga turun padahal harga pakan naik via
709,kecewa harga telur anjlok peternak ini lempar puluhan telur terus mau jadi apa peternak ini pakan naik terus harga harga telur terus turun masih ditawar murah daripada ditawar murah mending aku buang saja
710,harga telor turun kalau ini khususnya di magetan sendiri harga telor bukan pemerintah yg membuat tp ada pihak salah satu toko pakan terbesar di magetan yg membuat harga telor tp membuat harga telor jg tidak sembarangan ada perhitungan tersendiri
711,viral video peternak di magetan membuang telur ayam karena kecewa harga turun padahal harga pakan naik
712,mau komen ini dari segi yg jual pakan yg ikut merasakan dampak harga pakan naik harga telor turun
713,kesalnya harga pakan naik sampai rp per sak kalau pakan naik setidaknya telur tidak turun kata suparni
714,bentuk kekecewaan para produsen disamping ngambeknya rep netizen yg dilakukan sma bapa ini uda betul kok buat ngejaga harga telur biar makin turunsesuai sma hukum penawarannya smakin bnyk stok barang yg ditawarin maka harganya makin murahhemm smoga ekonomi indonesia membaik
715,polri reskrim harga telor itu spt saham naik turun tiap hari dan itu sdh biasa yang kasihan ayamnya disuruh bertelor terus kalau dah gak peoduktif tinggal digiling
716,harp saya nda paham harga telur turun gimana sih baru aja tadi pagi belanja telur masih rbkg loh apa mereka maunya kayak harga natallebaran yang bisa sampe rbkg gituh kalo maunya harga segitu ya gantian rakyat yang menjerit apalagi situasi lagi susah gini
717,polri reskrim njih mas buktinya jakarta harga ga turun koq telur siapa yg bermain ini seharusnya negara bisa hadir melalui untuk membuat sentra sentra yang menampung hasil peternak dan petani sehingga tidak dikuasai cukong dan tengkulak
718,mungkin bisa ngobrol dulu om sama peternak telur anda minta baik baik telurnya untuk penanganan bencana antara anda diusir mereka sudah marah harga telur turun terus seenaknya diminta atau dikasih telur mereka sudah pasrah dan mencoba baik untuk sekian kali
719,kalau pengusaha cerdas diolah menjadi hidangan berbasis telur tetep gk rugi walau harga tetep turun
720,nurhalim kadang digituin emang sengaja buat jaga harga biar ga makin turun semisal suplai telur ada dengan harga rupiah per butir lalu kasarnya dibuang sehingga sisa telur dan harganya naik jadi per butir kan malah lebih untung
721,aksi membuang telur disawah hanya karena harga telur terus turun adalah tindakkan yang tidak masuk akal
722,kmrn telor mahal banget sampai rbkg kita proteskan mrk jg yg merasakannya giliran pas turun harga murah knp marah dibuang bgt buat disumbangdi kasih gratis kpd yg bs mkn krn pandemi kan banyak bgt amat sih tuh bandar telor
723,teringat masa zaman ph dulu harga telur turun sen masa raya tahun baru cina lupakan harga lepas tu yang naik lebih lagi lepas tu tapi mungkin bila harga minyak dah jadi rm harga barang turun balik bila jiran di pd jadi pm
724,iyaaaa kasian ayamnya bertelur dengan sekuat tenaga malah dibuang telornya mana sebelumnya juga harga telor mahal banget sekarang giliran udah turun malah dibuangin mau marah banget terus juga lagi banyak bencana kenapa gak disumbang ke mereka aja sih
725,im cara mikir otaknyatelur dibuang harga pakan bisa turun
726,mungkin maunya cari untung dengan membeli banyakgak taunya grafik harga telor tiap hari naik turun dan dia rugi karena disaat beli dgn harga mahal ternyata harga telor sdh turunmemang desember kemaren harga telor gilaanhrs sering update harga pasar
727,rusli oh see ada masalah di pakannya berarti kalau harga pasar telur tentu kita perlu berfikir inflasi amp beban masyarakat jk harga tinggi soal pakan mungkin pemerintah yg perlu turun tangan jgn sampai peternak tak punya pilihan ibu gub yg bisa dimention soal ini
728,kesian bgt peternak ayam petelur harga pakan dunia naik ngefeknya ke harga telur turun
729,yin ah gak segitunya om kebutuhan telur itu continue semua orang maunya harga stabil tapi saat harga turun harus punya strategi pasca panen bikin produk turunan orang indonesia kreatif kok wong tahi ayam aja laku dijual kok saya pernah beli
730,harga telur blitar turun januari harga telur kab amp kota sudah hampir minggu petani merugi mohon kiranya untuk bisa dibantu
731,harga pakan naik terusharga telor turun terus maka peternaklah yg rugi maka peternak ada yg membuang telor hasil peternakan mereka bagaimana ini pak menteri pertanian
732,yin ok skrg paham entah daya beli yg naik atau intervensi dr pemerintah utk turun tangan atur harga pakan semoga ada solusi yang bisa meminimalisasi kerugian ya mbak terima kasih pencerahannya nanti saya beli telur lbh banyak
733,harga telor turun gais tp cabe makin mahal ya allah
734,yin ini jg dipicu harga bahan baku pakan dan pakan yg naik gilaan shg biaya produksi jd tinggi dilain pihak harga telur cenderung turun terus
735,harga telor turun nih wahai anak kos biasa sekilo sekarang cuma hehe
736,dear ibuibu harga telur ayam di padang turun nih
737,bikin ajitama ah btw kenapa harga telur gak turunturun malah naiknaik ke puncak gunung tinggitinggi sekali masa sekilo rb bund
738,ohhyg umum harga telor turun satu sen tu kahahaahah
739,telur turun harga om
740,harga cabe perbungkus kecil nggak ada setengah ons kayanya yg biasanya atau sekarang udah tembus tapi harga telur udah turun ke
741,harapharap yb dapat balik jawatan menteri sebab harga telur dah naik balik sejak zaman pn masa yb dulu dah turun sen
742,vay karyoso telor terus mentang harga telor udh turun
743,untung harga telur udh turun
744,iya harga pc naik turun dah macam hrg telor aja jd ya apa dia gak stress tiba anjlok wkwwkk
745,sempat alami kenaikan sekarang harga cabai dan telur ayam di kota pariaman kembali turun
746,zaman ph pun harga telur turun sen hihihi
747,harga telur dah turun kemarin sempat beli serak dan harganya hampir rebu itupun telurnya kecilkecil
748,harga cabe mahal harga telur turun harga diri kamu dimana
749,kenapa banyak akun telur berseliweran apakah karena harga telur lagi turun soalnya tadi pas beli telur harga telur saat ini kkg dari sebelumnya mencapai kkg
750,harga telor curah lagi turun
751,bhhaha pdnya naik turun kayak harga telor
752,dulu keluarga jd petani turun temurun pupuk mahal akhirx ga sesuai hasil sawah dijual coba ternak ayam pakan vaksin dan jagung mahal tp lumayan harga telur lbh tinggi dr ayam
753,hahahaha aku tau harga telur cenderung naik turun tiap hari tapi ku mau tau berapa harga jual mu
754,daging ayam broiler dan telur ayam broiler turun berikut harga kebutuhan pokok jawa barat
755,waa harga emas lg turun iya tapi harga telor gak turun wkwkwkwk mak
756,sempat naik harga telur ayam sudah kembali turun via
757,mau tau besok pulang sampe rumah di jkt harga telor udeh turun apa belon ye
758,alhamdullilah harga telir udah turun se kg rb bisa beli telor lg buat stok klo gk ada lauk mkn udh seminggu gak kepasar pdhl di kulkas udh gk ada lauk dan sayur klo cabe bawang tomat masih ada seminggu kalu nyetok beli cabe bawang dan tomat se kg stok beras msh aman
759,harga telur ayam ras mulai turun ayam br masih stabil psbb jawabali akan pengaruhi daya serap
760,kerajaan ph harga telur ayam turun sen pun buat sidang media
761,btw harga telur sudah turun lagi tapi akan naek menjelang imlek
762,harga telur ayam belum turun masih di kisaran rb
763,harga ayam dan telor mulai turun harga sayuran dan cabe menggila tempe naik krn harga kedelai naik cenah
764,ini yg bikin harga telor naik turun
765,tahu amp tempe langka karena harga kedelai naik tapi harga telur mulai turun
766,but sejauh ini dia ga protes sih paling nanya harga telor kapan turun wkwk
767,ngenteni harga telur turun
