,tweet
768,fess weh udah turun lagi harga telur
769,mentri perdagangan abis dilantik harga telor langsung turun kok kedelai gakbisa mavianya org hebat paling jaringannya sampai kelangit yg ke
770,harga telor turun ke kek plis gaenak ama warung nanya harga telor mulu ga beli wkwk
771,louisiana alhamdulillah telur bisa turun harga
772,harga telor turun
773,misalnya harga telur ayam ras dari awal pekan lalu rp per papan butir sekarang turun menjadi rp
774,sempat naik harga telur kini cenderungturun
775,harga telur ayam turun tipis di pasar lubuk buaya padang
776,harga telur turun dari rbkg jadi rbkg
777,grg harga telur turun cabe baek ayam stabil
778,harga telor turun serebu jg alhamdulillah
779,me harga telur sdh turun skrg cm kg
780,dari pantauan babinsa harga telor turun di pasar tradisional siak hulu serda aizur hedi babinsa koramil sh kodim kpr melakukan komunikasi sosial komsos kepada pedagang telur serta sekaligus memonitor harga kebutuhan lainya di pasar pagi desa teratak buluh
781,bukan pondok pinang bang tp emg lagi naik turun si itu harga telor kayanya
782,official betul tu sekarang ni harga telur pun dah naik sen balik sejak pn memerintah rindu zaman ph bila harga telur turun sen
783,harga telur turun jadi ribu aja gue udah seneng banget
784,harga telur turun tapi harga sayuran naik ini kata pedagang
785,harga telur diskon hingga popok mamy poko turun harga cek katalog promo indomaret hari ini
786,rejeki itu adalah saat dapat pesenan kue buanyak harga telur pas lagi turun merry christmas everyone who celebrate it
787,menurutnya masalah lain muncul yaitu dalam pemeliharaan terjadinya mortalitas atau menurunnya produksi telur terlebih saat terjadi pandemi covid seperti saat ini harga penjualan telur ayam yang biasanya tinggi menjadi turun drastis
788,nggak ada nder ttp dijual sm cangkangnya kl msh bagus harganya standar sama pasaran tp kl ada retak harga turun jd kepo itu satu bungkus harganya brp masuk hitungan harga telur atau pk timbangan beri tau aku nder aku kepo atau yg daerahnya jual ky gini jg
789,jelang tahun baru di batu bara harga cabai naik telur turun
790,sejak mentri perdagangan yg baru dilantik harga telor langsung turundari rbkg sekarang jadi rbkg eceran
791,tiap tahun itu yang konsisten adalah harga telur naik dan harga diri turun
792,telur mahal harga di peternak justru turun dan ikuti berita terkini lainnya di situs
793,soal harga telur turun drastis awas jebakan batman
794,harga telur selalu melonjak di akhir tahun ketua dpd ri minta pemerintah turun tangan via
795,kenapa harga telur puyuh yang turun harga yah
796,harga telur makin meroket dpr pemerintah harus segera turun tangan
797,ketua dpd ri minta pemerintah turun tangan atasi kenaikan harga telur jelang libur nataru
798,harga telur selalu melonjak di akhir tahun ketua dpd ri minta pemerintah turun tangan via
799,puncak kenaikan harga telur ayam terjadi di akhir dan sedikit turun di namun masih mahal
800,kalau jawabannya akurat pasti si admin udah jadi super sultan harga telor di pasar aja naik turun tanpa bisa ditebak apalagi saham
801,harga telur naik gak turunturun apalah aku yang cakenya pakai lebih dari telur
802,harga telor jadi naik mulu nih kl mungkinkah harga akan turun
803,grg apa gara ini harga telur turun hehee
804,harga telur masih menjulang banget rp kg udah sebulanan harganya nggak turunturun penjualan di toko kelontong ibuk juga jadi nggak sebanyak biasanya karena orang jadi urung beli kalo gula sama beras sih masih stabil
805,harga telur sdh kg semoga pas psbb bisa turun lagi karena telur lah makanan yg sanggup kami beli
806,biasanya harga telur jelang natalamp taon baru gini sih sekitar rb an masi lanjut sampe imlek tar abis imlek bakal berangsur turun lg
807,ditempat saya hrg telur rbkg harga pisang fluktuatif naik turun sementara harga susu masih paling menonjol hehehe
808,harga telur bukannya turun malah naik terus sekilo dah menyentuh rb
809,telur naik harga zaman phbergegar dunia skg semua harga turun cikgu
810,semoga harga telur segera turun
811,harga telor naik bund wkwkw cabai uda mulai turun
812,mentri perdagangan pak ri tolong investigasi harga pangan naik pak terutama telur habis bansos turun harga melambung tinggi saya hanya pedagang kecil pak
813,emgnya cuci piring masak mie masak telor nyapu ngepel tu bikin harga diri turun ya berat bgt tu tangan gamau ngerjain begituan
814,sumpah bengek bgt bapakku ga ngasi tau harga grosir telor fak ko tbtb harga nya turun jauh btl pas org ambl banya
815,bersyukur anjinc lu udah sampe mitik walaupun receh lah aing epic naik turun kek harga telur
816,rage kalau zaman najib harga naik bila kerajaan ph mansuhkan gst buat tax holiday ada barang turun takdaaa setakat telur turun sen tu heboh satu dunia tak payah bila diorng implement sst ada barang turun ke tak ada malah banyak yg naik waktu tu
817,iya nih harga telur malah turun mungkin banyak yg bertelur akibat wfh dari jadi
818,tunggu la harga bawang turun baru beli dulu masa harga telur naik pun kau bising sekarang senyap pula pasal telur dah murah
819,walopun harga telor naik turun kek mood nya cewe mens ttp ajaa dibeli wkwk
820,bm ayam makan banyakbanyak harga dedak naik then production ayam naik telur jadi banyak then harga telur turun econs
821,menteri harga makanan ayam naik telur turun hingga peratus
822,masue harga telur masing stabil yg ngak stabil harga karet dan sawitmasih naikturun
823,badan ini aneh timbangan naik turun dah kaya harga telor
824,wakil menteri perdagangan menegaskan kenaikan harga telur ayam masih wajar dan belum saatnya di gelar operasi pasar karena telur ayam cepat naik tapi juga cenderung cepat turun pula harganya berbeda dengan daging sapi yang sampai saat ini masih tinggi di indonesia
825,setelah sempat menurun harga telur ayam di pasaran kembali mengalami kenaikan hargadi solo misalnya harga telur ayam yang sempat turun di kisaran rp kini kembali ke rp perkilogramhal ini tentu saja membuat para ibu rumah tangga menjadi menjerit
826,harga sembako november surabaya ayam dan telur turun
827,didu bukan malah turun malah naikongkos angkot aja naikterus telor naik perkilo pasti gara gara blt udah cair jadi pada mahal harga kata toko grosir yg ngeluh
828,selama betul terjejas sbnrnya kian hari makin kurang jumlah telur yg boleh di export kesannya ada lambakkan telur ayam dlm pasaran harga telur kian turun kos penyelenggaraan kian naik
829,harga daging turun harga telor naik turun
830,harga ayam naik trus minggu terakhir hari ini dada ayam fillet sampai kkg dah gila wortel dan selada tetap aman telur ayam malah turun bbrp rupiah
831,saat ini harga telur ayam sudah mulai normal kembali setelah sempat mengalami kenaikan harga jelang liburan panjang akhir oktober kemarinsaat ini harga telur ayam sudah turun dari menjadi di sejumlah pasar tradisional di pulau jawa dan bali
832,sebelum ngespill bisa atuh dibedah dulu harga makanannya telor aja udh hitungan ribu nasgor ribu ayam ribu itu aja udah ribuan belum fruit tea dan mikabrosur itu kl usaha juga kena hitungan maz lebih proper di resto yaudah maemnya pas turun kereta aja
833,protesnya udh kek dipaksa beli sm pramugari dah pake dibandingin sama kurs negara lain pdhl di luar negeri harga makanan kereta smp ratusan ribu kalo mau murah pas di st kroya turun bentar mampir warteg bungkus nasi telor dia yg dumel gue yg malu
834,pantes akhir ini cm makan telor ceplok sm nasi garem ternyata harga pasar laki gue turun bgt
835,bulan tu pengalaman apa ayam pencen turun harga dgn telor turun sen utk hari come on laa menteri weyy
836,foto harga telur turun di momen libur panjang
837,harga telur turun rp perkilo harga telur turun rp perkilo harga telur di pasaran mengalami penurunan sebelumnya mencapai rp ribu kini turun menjadi rp ribu perkilo
838,sands harga makanan ternak lagi naik pak trus harga jual telur ayam sedang turun susah mau ambil keuntungan sekarang pak
839,perayaman juga pusing banget ini harga bahan pakan bungkil kedelai naik banyak sementara harga telor malah turun
840,gara gara ini dah harga telur turun peternak telur pada rugi
841,kementerian perdagangan ri menyatakan belum saatnya di gelar operasi pasar karena adanya kenaikan harga telur ayam di pasaran dalam beberapa hari terakhir inimenurut wakil menteri perdagangan harga telur ayam akan kembali turun paska liburan panjang akhir bulan ini
842,berat badan naek turun ae nih uda kek harga telor di warung deket rumah
843,membayangkan kapan harga telor dan snco turun
844,dah turun harga lah haritu papan rm aduh baru je beli telur kedai mamak
845,hahahah okay laaa daripada buat live tentang telor turun harga sen org nak info latest ko kalo xnk xyah tgok laaa
846,viii newbie harga telur dah turun belom
847,harga telur turun
848,sejak ada km lognus ditambah lognus hargaharga sembako seperti beras tepung terigu gula pasir telur ayam turun hingga
849,harga telor naik apa turun
850,ryuzin bu harga telor dah turun belum
851,undi sebab naktol free simpang renggam dapat mekdi mekdi pun mekdi lah asal jangan bangga sehingga buat sidang media untuk umum harga telur turun sen thank you bang tuah
852,ngotot bandingin dg malaysia yg keseluruhan penduduknya cuma sebanyak penganut kristen minoritas di indonesia beda tingkat kesulitan pengelolaannya skrg gimana perbandingan dg turki amp rusia ttg harga telur amp ayam naikturun dikit bawang sempat melejit tapi dah normal
853,ibaratnya hidup sebagai telur di ujung tanduk bertahan ga mungkin pasrah kaya gada usaha bgt buat hidup sebenarnya kalo memang punya kualitas gak usah ngerasa nilai jual lu berkurang berdiskusi gak bikin harga diri lo turun sist
854,beeeeee penyebab harga telur naik turun
855,nasib peternak ayam petelur di tengah pandemi nasib peternak ayam petelur di tengah pandemi selama pandemi covid harga telur ayam terpantau naik turun sempat naik mencapai rp per kilogram kini harga telur eceran turun menjadi rp per
856,foto harga telur ayam turun ke rp per kilogram
857,harga telor dipasar memang dibawah harga pisang yang naik turun sedangkan harga kacang selalu terjepit diantara harga daging
858,roller coaster mah ada muternya tong yg gw tau harga pisang yg suka naik turun tapi gak pernah dibawah telur sih
859,kalo diajak ngobrolin harga telur naik turun aku nanti langsung kepikiran hak buruh tani amp ternak
860,harga telur ayam di pekanbaru awal oktober ini turun tipis jadi rp per butir
861,harga telur ayam hingga tembakau turun pada september
862,bps harga daging ayam dan telur turun picu deflasi september
863,bps harga daging ayam dan telur turun picu deflasi september itukeren
864,pengen makan kue bulan cuma jangan dibeli sekarang soalnya harga pasti masih tinggi tunggu lewat hari biasanya harga turun pengen makan yang isi telur asin sama kacang
865,kalo ada orang bilang masa depanmu suram jangan maulah estimasi masa depan kagak ada yang tau seperti harga sembako yang perkiraan harganya naik turun bagi yang suka telur tiap hari makan lauknya telur sekalinya harga telur melonjak tinggi ya tetep aja beli telur
866,grg kemarin dapat harga berapa pak kog ya pas telur harganya terus turun ini
867,alghozali pantesan harga telor turun drastis harganya
868,harga telur ayam ras di pasar tradisional kota ambon turun jika dibandingkan beberapa hari lalu kini harga telur ayam ras dijual rprp per butir
869,new post in kabar orasnow antara news ambon maluku terkini harga telur ayam ras di pasar ambon turun channel
870,iyaa kopdar gitu kak yg diomongin qah harga tepung nik harga telor untung turun garam ga seasin dulu rindu telah berubah jadi piluuhahahahaha
871,harga daging dan telur ayam turun selengkapnya di
872,mcm org umun harga telur turun sen
873,salah satu hikmah pandemi tau harga pasar lagi naik atau turun karena di grup komplek pada jualan macemmacem termasuk lauk pauk bbrp hari terakhir ayam telur sapi lagi turun padahal bulan lalu pas baru pindah sini telur masih ribuan hari ini ribu
874,harga telor lagi turun harga diri gak naik naik mamang jek
875,berita baik hari ini harga telur turun jadi rbkg
876,ckp shj pandai mcm sebelum pru lah mcm janji termasuk turunkan harga barangan keperluan tapi bila dah jadi menteri kpdnhep apa harga barangan yg turun melainkan telor ayam turun sen sembang saja deras habuk pun tak ada
877,harga pisang naik turun harga susu membumbung tinggi harga kacang smakin terjepit harga telur tergantung
878,harga telur kemaren turun kg aja
879,sempat tinggi harga telur ayam di lubuk basung berangsurturun
880,sempat tinggi harga telur ayam di lubuk basung berangsurturun
881,kalo aku mending sekalian beli telor sekilo dapet butir harga sekarang turun rb untuk ayam lebih suka beli paha atas atau dada fillet kg
882,harga bamer baput naik harga telor turun info bajer kemendag bagian bayoran lama
883,telur ayam blitar sehat untuk konsumsi turun harga ecer kg grosir min kg grosir min kg
884,tweet ini mengandung bawang finally you both happy with your own way thanks ka mala au nya membawa emosiku naik turun kayak harga telur ayam kutunggu di universnya boss dan peaches sksksk
885,cah apa cuma aku aja yg pernah beli makan niat ngirit sampe bilang ke penjual gausah pake telur atau ayam ngirain harga bisa turun eh taunya ternyata ayamtelur itu sepaket
886,selama gw jaga toko belakangan ini gw amatin harga gula telur beras selalu naik turun tapi kenapa harga rokok selalu naik ga pernah turun
887,emosi hari ini naik turun kaya harga telor
888,harga telur di pasaran seringkali naik turun ada tren waktu harga telur naik atau justru turun
889,telur merupakan salah satu komoditas utama penyumbang deflasi pada agustus lalu sampai sekarang harga telur terus turun
890,harga telur ayam mulai turun karena stoknya mulai banyak sebagian besar telur ayam yang dijual di pasar tradisional kota jayapura didatangkan dari surabaya jawa timur
891,papua harga telur ayam di kota jayapura mulai turun
892,harga telor turun rban tapi harga ayam naik ribu amsyooongggg
893,harga telur hari ini turun
894,yuk ready stock telur ayam stock melimpah turun harga rbkg free ongkir malkot malang
895,ya dua kali liat berita ini tapi aku masih makan telortelor aja meskipun harga ayamnya turun soalnya telor makannya nyicil deng ga kek ayam
896,harga telor turun bahagia bgt
897,kapan hari habis beli ayam bagian dada di filet gr sama bagian paha dipotong gr totalnya semua disurabaya dipasar deket rumah harga ayam sama telor bisa naik dn turun
898,udah lama baliknya dia kalo mau ke pasar bisa dapet lebih murah beh standard aja sih kek tempe sepapan rb tahu juga rb bayamsawi seiket rb yang harga naik turun ayamikantelur
899,cicilan kpr masih puluhan tahun lagi harga telur kayak harga saham naik turun spp kuliah numpuk efek pandemi
900,kemarin harga telur sekilo langsung dah beli kg ada yg kek saya suka nyetok klo harganya lg turun telur mah wajib ada di rumah anak suka banget makan telur dadar atau utk dibikin nasi
901,jual telur rp kg minor ikat beli lebih ton harga bisa turun pengiriman gratis km diatas itu disesuaikan
902,harga telur mengalami penurunan meskipun tidak signifikan dari ribu turun menjadi ribu rupiah sedangkan harga daging ayam setelah kemarin sempat turun menjadi ribu kini harganya sudah normal yakni ribu rupiah
903,btl semangat bawa sampai ke hari ini berjaya turun kan harga telur sen dan berjaya mengira ikan kembung bilion tahniah salahuddin
904,etapi hukum supply amp demand ga berlaku loh disini sejak warung yg jual telurnya cuma atau warung sampai skrg gt warung harga telur ga kunjung turun pdhl supply makin banyak
905,ntlfiaccount mbuhh bukan masalah harga di pasar sih masalahnya tu di daya beli tengkulak ga mau rugi suplai normal permintaan turun mau berharap apaan martabak telor spesial hehe
906,jafar kapan telur kg turun harga menjadi rb
907,disisi lain harga telur alami kenaikan harga cabai turun lagi
908,gini loh mas gembel nilai uang itu juga naik turun yang gak berubah cuma angkanya saja uang kan alat tukar sama saja dengan telor dan ayam inget kan piala dunia tahun lalu garagara banyak nobar harga telor naik karena banyak yang butuh telor sampe sekarang gimana
909,mahal sbb india juga takde org kejar tauke yg sembunyi barang dulu kejar telur turun paras harga terendah
910,analogi nya elo pedagang telur beli di grosir pada saat harga nya turun drastis ya elo jual nya juga turun dong harga nya kalo elo bilang bisa rugi mending komut nya ngurus bini ama baby nya di rumah saja lebih asyoiiiiii
911,terakhir harga jumat dari komoditi hasil dan harga turun pd ayam ras amp ayam broiler jtg
912,ourange kadang emng males ngutangin orang ya gitu suka gak sadar dan pura pura lupa punya hutang pas ditagih alah segitu doang pun lah dia kira harga telor bakalan turun kagaak njir
913,penggiat musik budi senyumnya terbahakbahak setelah mencoba telur asin frogstone tunggu apalagi order sekarang juga senin harga naik selasa turun lagi telur asin dari silit bebek pilihan isi butir piagam penghargaan harga narahubung
914,udah turun kok harga telor kak
915,terakhir harga senin dari komoditi hasil dan harga turun pd ayam ras jtg
916,update harga telor hari ini udh turun guis
917,di dalg telor malah turun harga gaes
918,saben sasi juli ki omzet mesti turun drastis merga mbayar sekolah namanya rezeki dagang ya pasang surut kalo memang ekonomi lesu nyatanya gak ada yang punya hajatan tapi harga telur tembus perkilo wes ojo digebyah uyah doakan saja keadaan makin baik
919,terakhir harga kamis dari komoditi hasil dan harga turun pd ayam broiler amp ayam ras jtg
920,karpet isi berapa tuh iya sih disini sekilo nya padahal waktu bulan puasa sempet ngerasain harga rb wkwk belom turun turun yaa ayam nya pada kena dampak covid kali yaa jd gamau produksi telor
921,wow makanya moodku jele bgt naik turun spt harga telor di pasar
922,harga telor udah kaya emas dah naik turun
923,awal bulan ke pasar harga kangkung per ikat dan bayam per ikat tadi pagi ke pasar udah dapet kangkung dan bayam jadi harga sayuran udah turun sekarang yang mahal telur
924,sempat membubung harga telur mulaiturun
925,harga daging dan telur ayam diprediksi turun juli ini via ayam pejantan jakarta pt apm
926,harga ayam di pasar tradisional banjarmasin masih bertahan telur turun rp harga ayam per ekor di pasar tradisional kota banjarmasin tetap ukuran besar rp dan lebih kecil rp
927,harga ayam di pasar tradisional banjarmasin masih bertahan telur turun rp
928,ibrahims pudin ni manusia tak leh pakai takat bole turun harga telor sendiri sen je
929,utara jgn nk mnipu semasa dibawah ph harga ayam rm ke rm yg murah ayam tk di sembelih yg turun hahaha telor ayam gread sen hahaha ph lgi kaki auta
930,tasya apalagi pake ayam pusing harga ayam dan telur naik turun
931,monmaap ya folls twt gua ngapa naek turun mulu kea harga telor di pasar
932,menu ekonomis rumah makan kertanegara rice bowl kertanegara turun harga hanya rp box ada varian menu yaitu kumis cumi goreng renyah dan ayam sc telur asin po bisa langsung whatsapp messenger di
933,mendekati hari raya idul adha hijriah harga telur ayam ras di pasar parit baru kabupaten justru turun jika sebelumnya harga telur mencapai sampai ribu perkilogram kini turun menjadi hingga ribu rupiah perkilogram
934,hai mau cerita yaa martabak telor favorite turun di halte tj layur segelundungan nyampe sebelum rm padang sederhana pas di pojokan gang ada martabak telor dan martabak manis oh ya ada martabak ketan hitam nya juga harga masi masuk akal buatku ya hehehe
935,iy pd ributin harga yg turun drastis grgr semua pd bisa jd fh dan pd jual tutor kayak jualan kacang telor banyak bgt
936,sekarang belanja sembako makin mudah pesan kebutuhanmu sekarang pake aplikasi rekom mau beli telur minyak gula beras dan lainlain tunggu apalagi yuk lengkapi semua kebutuhanmu dengan rekom harga bisa naik turun sesuai harga pasar
937,harga bawang merah di pariaman mulai turun harga telur naik
938,nggilani jip harga diri telor jadi turun huhu
939,harga daging dan telur ayam diprediksi turun juli ini
940,kota lubuklinggau bulan juni mengalami inflasi sebesar persen kenaikan harga komoditas seperti daging dan telur ayam ras dikarenakan panen terganggu sebagai imbas penurunan produksi di masa pandemi sebelumnya sedangkan permintaan tidak turun
941,biasanya menurut mereka yg seperti ini pengen makan enak plua mewah tp murah krn mereka ngga pernah merasa buat jd seenaknya aja minta turun harga namanya makanan itu kualitas bahan yg di pakai juga menentukan rasa dan harganya busyet telur aja kg ribu
942,barang baru datang baru turun truk telur berkah mantuull info harga dan pemesanan jangan sungkan untuk kontak kami yaa hubungi wa kami
943,yorijkt lulujkt ketoprak tambah telor amp kerupuk melimpah dekat pasar senen katanya turun harga
944,ibuibu rempong pas ngobrolin harga ehh jeng telur sekilo berapa ya sekarang ihh naik udah ribu sekarang ihh mahal amat pemerintah tega ya ngasih hargamahal amat ibuibu sosialita para investor jeng emas sekilo berapa ya jeng turun ya wa beli ah
945,fess terus harga telor turun
946,internet turun naik kayak harga telur aja
947,terakhir harga kamis dari komoditi hasil dan harga turun pada ayam ras hingga jtg
948,mau ngelupain mantan aja semangatnya kayak harga telor naikturun
949,telor asin bonus mainan gitu ya konsepnya kalo harga kinderjoy turun
950,harga ayam potong di pekanbaru turun tipis rp per kilogram telur terpantau stabil
951,jadi penentu utama perubahan harga di pasaran ini tuh apa ya sebenernya cepet bgt naik turunnya nah skrg beberapa agen telur lg bingung nih pasokan langka biasa skrg ada yg nawarin perkilo macam emas antam aja naik turun mulu
952,tsuyoshie nih gw kasi bocorannye harga telor dibawah pisang harga pisang turun naek
953,tulisan ponakan sd bagus bener yak betewe ini harga telor sekarang yak naik turun kek harga rupiah ke dollar
954,kriss beli apa dipasar harga telor dah turun blmmm
955,baru turun barang nih fresh bgt datang dari kandang kuy lah order telur berkah partai besar pun kami siap melayani info harga dan pemesanan jangan sungkan untuk kontak kami yaa hubungi wa kami
956,dana pkh lagi turun harga telur ngelunjak naik
957,harga emas turun dan naik atau harga telor naik dan turun tidak yang terjadi adalah nilai imajiner uang fiat yang terus turun kehilangan daya beli paradigma uang fiat dan riba
958,telur infertil rusak harga pasar peternak ayam petelur di sumedang keluhkan omset turun
959,kayanya harga telur mah naik turun terus gabisa jd patokan
960,hujung nak grade dua lepas tu mintak lagi harga kurang nak sama dgn telur gred tadi aduhhh tepuk dahi aku wehhh kau dah bayar kurang kau terus blah je dah la nak turun kedai aku yang angkut semua telur pegi kereta dia aku tak de pulak rasa nak judge kau
961,doraredre harga telur turun drastis
962,didu harga minyak dunia itu naik turun klo pengecer ngikutin ya amburadul sama kyk harga gula amp telur di grosir naik turun tiap hari klo pengecer ikutan naik turun yg beli bingung
963,konteksnya kayak lagi ngomongin tetangga yang suaminya kerja di luar negeri ya bun tidak lupa tanya harga telor udah turun belum
964,kalo lele ga susah bang mau ngelemparnya ke mana kalo harga lagi turun tinggal tahan aja lele nya jangan buang ke pasar tmpat pemancingan pasti mau nerima kalo lele ukuran gede untuk telor riject bisa ke grosiran telur bg
965,wishlist bulan ini ipk naik pandemik cepat berakhir menang giveaway gaji bapakku gak dipotong lagi harga telor turun wkwk
966,sedangkan telor ayam kg rb akhirnya memutuskan untuk ngeborong tahu tempe ikan asin ama ikan pindang dulu semoga minggu depan harga ayamnya udah turun
967,pengen harga kinorjoe turun apa gk kenyanggg dh blg tu telur buaya agar gk beli ttep si kecil gk gk bisa boongin mainannya gk bisa smpen
968,bahas harga telor yang naik turun
969,bb gue dah kek harga telor naik turun
970,masa sulit ayam udah minta ganti produksi menurun kebutuhan makin bejibun harga telor masih naik turun mobil operasional di tabrak orang ya allah paring ono sabar lan tawakal
971,mantap akhirnya bahan pokok turun harga bawang putih gula minyak curah telur minyak goreng beras inflasi juga rendah krn adanya kebijakan utk mengatur produksi stok logistik amp eksporimpor terima kasih utk pemerintahan pak
972,gula pasir kualitas premium turun rp per kg dari rp menjadi rp per kg minyak goreng curah dari rp jadi rp per kg telur ayam ras segar juga alami turun harga dari rp per kg menjadi rp per kg
973,ada yang udah ke pasar lagi setelah lebaran kabarnya harga dagang bahan pokok dah turun dan normal lagi aku baru beli telor tadi pagi cuma malah sekilonya
974,tetap kubelingapain ngeluhdr dulu juga sama aja harga naik turuntelur naik kl butuh tetap belipinter aja ngatursekarang bawang merah tempatku mo ngeluh misuh ngapain buang energibagus aku puter otak nyari jln keluar sendiri
975,kelima telur ayam ras segar yang kerap dibutuhkan masyarakat menjelang lebaran juga mengalami penurunan harga dari rp per kg menjadi rp per kg keenam minyak goreng kemasan bermerek turun rp per kg dari rp menjadi rp per kg
976,minyak lain tak nak sebut harga ke bersikap adil la tapi paling murah zaman ph telur turun sen
977,temenin mama kepasar ih viatuhtuh telor turun harga lagi tuhkemaren mami beli mahalbeli lagi deh yuk emang mami beli hrgnya brp mkemaren kg skrg kg tuh
978,pusing harga ayam potong mahal bgt telor lumayanlah stabil harganya gula pasir udah turun tp lumayan mehong syukurnya jarang minum manis jd ketulunglah uang belanja bawang merah nih yg lg menggila cabe turun drastis sih parah bgt gak kebayang petani dpt untung brp
979,new normal indomietelur rebus harga turun
980,arjuna cuma harga telur yg sempet naik dikit itupun udah turun lagi
981,yoenswid abie ep biasanya berbanding terbalikkl harga susu turun pasti telor naik
982,sumpah ya harga telur disini kaya harga saham tiap hari bisa naik bisa turun dan ditulisin di papan atau kardus harga telur hari ini
