"score","text","klasifikasi"
-1,"dampak pakan mahal harga telur anjlok ternak blitar tunda cicil pinjam","Negatif"
-1,"its not harga petai rakyat keluh harga ayam bahan perlu sumber protein murah readily available harga keduadua ayam telur lambung pantau tiada niat kawal harga","Negatif"
-1,"harga telur ayam ras tingkat ternak magetan anjlok biaya produksi","Negatif"
0,"ternak ayam telur jawa timur hearing komisi dprd jatim instansi kait solusi harga telur anjlok","Netral"
-1,"serius mcm telur gred harga gin peras","Negatif"
0,"harga ayam telur makan harga haih","Netral"
0,"harga telur ayam boyolali merosottajam","Netral"
0,"harga pasar cecah rm harga niaga rm telur ayam gred rm sngt","Netral"
0,"menteri kawal harga ayam telur ayam minyak harga makan jaga harga keluar nyata bijak","Netral"
0,"harga ayam makan telur ayam harga telur","Netral"
1,"dagel politik harga telur bang pakan ayam murah jagung kedelai import minum formula sehat","Positif"
-4,"pastu kat kereta bawak gila barang beli telur beli telur telur pulak bayar harga telur rm segan beli bareng sikit hihi percaya gais perempuan nak beli barang je dusta je","Negatif"
2,"every week grocery shopping dok perhati je raja takde plan kawal harga barang ayam harga telur harga minyak payah cakap nak rakyat makan nasi garam je","Positif"
1,"ketua hkti apa sejahtera anggota kecuali keluh komplain harga telor stabil kisar arah ternak melek digital jual makelar dan lain","Positif"
0,"minggu telur harga berita","Netral"
-2,"gila weh lepas minyak masak minyak paket je kawal harga ayam suruh beli pasaraya harga telur weh apo","Negatif"
2,"harga ayam telor ayam dadak belakang perit nak hadap rakyat marhaen kuasa penguatkuasa tewas kuasa guna","Positif"
-2,"ternak rugi harga telur anjlok gaprindo datang dprd jatim via","Negatif"
0,"hshshs telur harga pentoi beli gred beli je tk koser","Netral"
-1,"harga telur ayam ras anjlok","Negatif"
-1,"mesti beli nasi lemak harga rm nasi sambal timun kacang telur dadar kecik ikan bilis takdak nak telur rebus sen bengang doh bengang","Negatif"
1,"harga telur bebek banyak jual butir","Positif"
0,"harga telur bebek kg","Netral"
0,"porsi bubur porsi topping sate tusuk telor asin sambel kerupuk wadah mika cutlery stiker packaging murah banget harga aplikasi beli murah paham promo bayar include ongkos kirim","Netral"
0,"harga telur ayam alami turun harga telur agen harga rp kilogram kg harga normal kisar rp rp kilogram kg","Netral"
0,"yang lain perhati harga telor blitar","Netral"
-1,"malas nak cucuk duit hahaha kedai xpatot nasi telur kicap jer rm patot jual harga ambk nasi telur kicap kot adeh","Negatif"
0,"komoditas alami turun harga telur ayam broiler cabe rawit hijau","Netral"
-2,"kecewa harga anjlok ternak bebas warga ambil telur ayam kandang","Negatif"
1,"raja kawal harga makan ayam duduk meja main industri discuss duk suruh turun harga je manjang rugi syarikat untung nama raja netizen jenguk syarikat telur ayam untung gila gila","Positif"
1,"syarikat telur untung untung farm tutup nak survive lepas tinggal player silap harga turun lingkup syarikat ayam orang hahaha nak","Positif"
1,"harga telur ayam harga ayam lambung faktor utama harga makan ayam mahal faktor raja kawal harga telurampayam mintak syarikat turun harga mintak rakyat beli mall harga murah karut","Positif"
0,"harga telur papan biji","Netral"
0,"news read today telur ayam harga sensen gred","Netral"
-1,"harga telur ayam ayam mentah facing shortage ayam right now main harga","Negatif"
1,"ahli unggas tera harga kilo telur turun","Positif"
0,"harga papan telur saar rbdlm minggu kisar papan telur","Netral"
1,"pempek radial asli palembang pempek lem telor lenjer ada lenjer kulit paket harga jangkau minat order dm","Positif"
0,"harga daging ayam telur turun harga pakan fadli zon unggas nasional sekarat download aplikasi tribunnews berita baru dapat android","Netral"
-2,"anomali pakan mahal tapu harga telur anjlok ternak jatim wadul dprd jatim","Negatif"
-1,"harga ayam lambung harga telur sardin mahal ikan bilis main gila harga ekonomi msia sdg kembang","Negatif"
0,"zongiliran harga telur bicara mahal","Netral"
0,"beli kat pasar raya kg dh hinggit choi ayam harga ayam telur dh mahal","Netral"
0,"harga daging telur jeblok fadli zon sektor unggas sekarat","Netral"
0,"diitung makan pakai pakan ayam nama dedak kilo ubah ayam betina harga telor ayam kampung nelor bareng ekor butir butir","Netral"
-1,"kampanye sehat kampanye pesan mayoritas kandang batre dipake hmpir smua ternak lokal kran impor jagung sulit harga pakan harga telur murah ternak kcil bangkrut mikir usaha kcil","Negatif"
0,"kalut harga telur ayam papan rm tertawa papan biji telur papan biji telur kaw kaw rm gred","Netral"
-1,"ternak keluh dewan harga telur anjlok pakan mahal","Negatif"
0,"telur gred harga ringgit je papan harga dkt ringgit naik","Netral"
-1,"harga pakan ternak naikin harga jual produk telor daging dsb daya serap rendah ppkm warung makan batas hajat ramai daya konsumsi solusi cari alternatif pakan murah untung maksimum","Negatif"
-1,"sekjen dpp ppp arwani thomafi resmi canang gera konsumsi telur ayam pulang pergi assunniyyah kencong jember langkah upaya bantu ternak ayam telur alami turun harga lengkap","Negatif"
0,"harga telur papan biji","Netral"
-1,"telor ceplok stengah mateng harga mati","Negatif"
1,"lecturer duk cakap pasal transparency supply chain tulah food sufficiency ayam telur malaysia bkpe mahal harga dedak","Positif"
0,"gasanggup bicara tujuh kuda kemarin tempe telur daging ayam bulu domba harga","Netral"
3,"anda kandang ayam baterai larang petisi mohon harga telur grundel harga sesuai kualitas modal terima kasih","Positif"
0,"rakyat sengsara telur ayam harga","Netral"
0,"kpdnhep kenal inisiatif baharu bendung harga munasabah ayam telur","Netral"
-1,"jenguk harga telur habis mco tak ayam susah nak telur kot","Negatif"
-1,"receh depan saji makan harga mahal ngangkat topik obrol harga jual sayur deket rumah patok lipat harga pasar bayam ikat jual telur kg jual ribu kilo","Negatif"
0,"harga ayam akal takat harga ayam je harga telur ayam mahal","Netral"
0,"hapal harga telor tengah sibuk","Netral"
0,"harga daging ayam telur turun harga pakan fadli zon unggas nasional sekarat","Netral"
0,"labilabitak wakil rakyat kpdnhep kawal harga telur pandaiitu harga barang turun lagicuma silapharga kangkong turun","Netral"
2,"hkti desak perintah sedia jagung harga rp sesuai harga acu perintah jamin harga telur ayam sesuai harga acu urgent perintah","Positif"
1,"pandang kondisi unggas nasional baikbaik tolong perintah jamin sedia stabilitas harga jagung pakan unggas perintah jamin harga telur tingkat ternak","Positif"
0,"pakar harga telur","Netral"
-1,"kondisi turun parah harga telur parah bijak cutting telur tetas afkir tejadi oversupply daging ayam sinyalir cutting telur tetas potensi rembes pasar tekan telur konsumsi","Negatif"
-1,"pakan jagung turun parah harga telur perintah diam ribu bahasa","Negatif"
0,"harga rp tahan harga rp ajaib harga telur kandang turun parah rp","Netral"
-1,"harga acu kg telur dasar permendag harga kandang rp rp patok harga jagung rp harga acu telur naik harga jagung rp rp kg","Negatif"
-2,"pakai harga jagung rugi rp kg telur ternak rugi","Negatif"
-2,"harga kandang kg telur kisar rp rp hpp telur harga jagung normal rp redaksi rp ternak rugi rp kg telur","Negatif"
-2,"tinggi harga langka sedia jagung kalkulasi hkti harga pokok produksi hpp kg telur daging ayam signifikan malang harga jual telur turun parah","Negatif"
-2,"sektor unggas jatuh timpa tangga sekarat ternak rugi harga pakan jagung pakan harga harga daging ayam telur ayam turun telur turun nyungsep","Negatif"
-1,"sektor unggas nasional daging broiler telur layer kondisi prihatin harga pakan sama harga jual daging telur turun","Negatif"
0,"weyy harga telur mahal harga bareng bakeri ceritaa","Netral"
0,"harga ayam telur ayam minyak","Netral"
-1,"harga cabe telor turun banget puyeng kepala harga mihilll","Negatif"
1,"telur karton ewarong ratarata jual harga harga tetap tim kece wajar ukur","Positif"
0,"harga jihoon batas sate telor puyuh","Netral"
-1,"nyata media kpdnhep ambil dekat baharu tangan isu harga ayam telur","Negatif"
1,"harga telur raja","Positif"
1,"pempek radial asli palembang pempek lem telor lenjer ada lenjer kulit paket harga jangkau minat order dm","Positif"
-1,"harga telur mahal kilo rumah cuman","Negatif"
0,"harga ayam telur","Netral"
-1,"telur dadar harga mati","Negatif"
0,"ko kawal harga telur ko xnak kawal harga dedak cheeeyyytttttp","Netral"
-1,"pantes harga telur anjlok","Negatif"
0,"basket telur vintage pita cutegemes muat telur harga","Netral"
-2,"tindak ambil harga telur ayam tingkat kartel manipulasi peringkat rantai nanta linggi","Negatif"
1,"harga asli pakai diskon panen telur tinggal doang","Positif"
0,"ayam main canak skrang harga rm kilo telor harga","Netral"
0,"jual telur alami turun harga pakan mahal","Netral"
-1,"telor dadar harga mati telorasin","Negatif"
-1,"harga telur ancurancuran jual ayam harga anjlok","Negatif"
-1,"ternak bukabukaan picu anjlok harga telur","Negatif"
0,"komoditas alami turun harga telur ayam broiler cabe rawit merah kentang","Netral"
-1,"harga telur turun drastis turun dpet diskon ibuk toko biru","Negatif"
0,"harga telur anjlok moga baik rogok kocek","Netral"
0,"harga telur sana","Netral"
0,"embun campur sisa gerimis soreditemani istri scanngkir kopi bahas harga telur","Netral"
0,"kirain harga telor gondal gandul","Netral"
-1,"ayam je telur harga gred cecah rm dkat hanat tol makan sardine je lepas","Negatif"
1,"pempek radial asli palembang pempek lem telor lenjer ada lenjer kulit paket harga jangkau minat order dm","Positif"
0,"ayam suruh pon naik harga dorang telur dorang mandai naik harga","Netral"
1,"harga telor kunaon turun harga kalapa maha tanam sayur up down hahakarena kerja ahli cerita weh","Positif"
0,"harga minyak jrg rm even syiling rm salunya promo pon rmetc telur pon mahal rm grade ayam sure","Netral"
0,"dih kakak eca ultah bahagia level up day wish all best moga harga telor warung labil","Netral"
0,"nanta linggi harga telur sebijik ringgit","Netral"
0,"telur ayam harga dadak","Netral"
-1,"bungkus makan malam jam set daerah belah terminal bratang harga lauk telur dan kawan","Negatif"
0,"minyak ayam telur harga main","Netral"
-1,"dagang pasar heboh harga telur ayam tingkat ternak anjlok rp kg","Negatif"
-1,"sumbang harga barang mahal minyak masakayamtelur harga","Negatif"
0,"stok limpah harga telur ras alami banjarmasin alami turun","Netral"
0,"stok limpah harga telur ras alami banjarmasin alami turun","Netral"
-2,"ciri warung tegal radikal harga telor dadar ceban malu telor gocengan warnaspad tebel","Negatif"
-1,"guis open order ekado isi telur puyuh balut daging ayam isi mozarella harga kpack pcs dom malang ongkos kirim via shopee mesan dm","Negatif"
1,"jual tteokbokki harga cup biji tteok biji sosis stengah telor yeeee pakai gochujang asli","Positif"
-1,"fess open order ekado isi telur puyuh balut daging ayam isi mozarella harga kpack pcs dom malang ongkos kirim via shopee mesan dm","Negatif"
-1,"fess open order ekado isi telur puyuh balut daging ayam isi mozarella harga kpack pcs dom malang ongkos kirim via shopee mesan dm","Negatif"
-1,"nak kawal harga ayam telur korang paham rakyat susah","Negatif"
-1,"harga telur anjlok harga pakan mahal ternak galaooo lauk telur praktis cepat saji ceplok sapi telur dadar malas masak mie telur beres","Negatif"
0,"del telor kilo harga","Netral"
-1,"usul cerdas emosional hilang logika gara gara harga telor jatuh mendag suruh mundur","Negatif"
0,"harga telur ayam trenggalek turun rinciannya","Netral"
-1,"beli telur kejut mat jenguk harga","Negatif"
0,"harga ayam pasar kajang rmkg naik harga makan harga telur gred senbiji","Netral"
1,"cakap harga ayam makan ikan harga minyak masak pakai pressure cooker harga telur ayam pakai telur suami","Positif"
1,"pempek radial asli palembang pempek lem telor lenjer ada lenjer kulit paket harga jangkau minat order dm","Positif"
-1,"harga telur murah harga pakan jagung mahalll ternak kapok ternak mbuh pusing negoro gur sibuk mbangun dal sdangkan dal pangan cilik ruwettt","Negatif"
0,"bawa harga telor kang","Netral"
-1,"kbtln tante buka tokowarung kemarin harga telor turun bnyak bawah rbkg njenengan endog","Negatif"
0,"salah soto ayam recomen kota malang segi porsi harga komplit lokasi dkt psr bunul soto cak boneng kulit telor muda istimewa antri sabar kesini","Netral"
-2,"harga telur mcm bahulu kene kurang kuantiti mmg rugi bagai ikut telur mahal harga rm rm","Negatif"
-2,"ternak rugi harga telur ayam alami turun lengkap","Negatif"
0,"harga telur turun bulan","Netral"
-2,"baca utas pean modal jagung sekian pakan sekian lada harga telur turun sisi lindung tani sisi produksi telur ngatur harga jual telur nulis utas koreksi","Negatif"
1,"ayam harga telur pon harga makan pon harga duit kuasa beli hilang betui","Positif"
-4,"teman jual nasi lemak harga okay dekat nasi lemak telur dadar rm nasi lemak telur rm nasi lemak ayam goreng rm kuihmuih ketul rm","Negatif"
-2,"dii medan harga telur wagub congor hrsnya kendali otak cerdas alih otak kadrun","Negatif"
-1,"harga telur anjlok harga pakan mahal ternak galaooopadahal lauk telur praktis cepat saji ceplok sapitelur dadarapalagi malas masak mietelur beres","Negatif"
0,"harga telur anjlok ribu kilo ternak bagi telur gratis warga ambil kandang","Netral"
0,"wagub jatim emil elestianto dardak hadap nasional harga telur harga harga pokok jual hpp","Netral"
0,"sejarah harga telur gred rm gila raja doe","Netral"
1,"fess nemu kentang goreng topingnya pelit bumbu oke harga oke diskon digrabfood mantap pokok telur matang dipecahin campur","Positif"
-3,"apasallah harga ayam mahal kasihan mk jual nasi lemak jalan telur ayam samamcm mana dorang mencaei rezki hargayg jual mahal gila patut sebenarnyacubalah turun harga","Negatif"
1,"pempek radial asli palembang pempek lem telor lenjer ada lenjer kulit paket harga jangkau minat order dm","Positif"
0,"fess upgrade harga telur","Netral"
-2,"hitung ternak ayam boyolali harga telur anjlok sejadijadinya rugi rp miliar","Negatif"
-1,"harga telur ayam ras pati anjlok via","Negatif"
-2,"harga telur anjlok ternak bantul rugi","Negatif"
0,"tula niaga masak macamanalah niaga makan serap kos bahan asas ayam mahal telur mahal minyak masak mahal harga makan nak nnt langgan marah mesti margin untung kene","Netral"
-2,"craving nasi lemak ayam rempah pastu cari then jumpa beli nak bayor nyesal pulak bagai ikut bungkus hinggit apakk mahal bagai ikut lauk telur ayam harga kakak kepala batas","Negatif"
-1,"harga telor ayam jatuh brow","Negatif"
-1,"rumah harga telur kilo","Negatif"
0,"harga telur remuk","Netral"
-1,"fess open order ekado isi telur puyuh balut daging ayam isi mozarella harga kpack pcs dom malang ongkos kirim via shopee mesan dm","Negatif"
-1,"harga telur ayam anjlok sebab","Negatif"
0,"minggu kaget harga telur rbkg harga kd rbkg kemarin harga uda turun kg im bahagia ternak ayam telur rugi turun harga telur ikut turun harga pakan tetek bengek","Netral"
0,"harga telor turun banget plis ayah ambil jual toko what the fuck empat ribu ratus what the fuck kobisa turun segitu","Netral"
-1,"guis open order ekado isi telur puyuh balut daging ayam isi mozarella harga kpack pcs dom malang ongkos kirim via shopee mesan dm","Negatif"
-2,"ramai beli ayam telur pasar raya jual ayam telur harga rendah langkah wujud suasana menangmenang guna mahupun niaga peniagapeniaga jangkit covid","Negatif"
-2,"hasil analisis wajib kenal naik harga ayam telur sebab tingkat kos bahan utama makan ayam iaitu jagung soya minyak sawit mentah jagung soya hitam diimport negara","Negatif"
-2,"difahamkan niaga burger mungkin paksa naik harga jual sebab tingkat harga ayam telur implikasi laku tingkat harga beban naik kos pindah beli guna","Negatif"
-2,"harga telur anjlok ternak kota malang ancam gulung tikar","Negatif"
0,"hitung harga jual balik harga total bahan pokok pakai harga bowlnya masuk harga total bahan pokok ngitung harga bahan gin telur kg anggep isi","Netral"
0,"harga minyak mmg nampak jalan nak turun harga ayam cecah rmkg harga cili ret ret nak turun harga telur even gred cecah rm barang yet people ask sambal belacan pundek","Netral"
1,"okay je split bills okay order makan maggi goreng double telur extra anggur susu time nak bayar letak duit harga kakak perempuan ais gelas","Positif"
-1,"ternak harga telur anjlok rp kg","Negatif"
-1,"harga telor anjlok","Negatif"
0,"last beli minyak botol besaq ringgit dh harga cerita harga telur ayam jgak","Netral"
-1,"harga telur ayam jakarta rendah rp kilogram","Negatif"
0,"tan ternak wajar harga telur kg minggu tan gaji ternak atas kg minggu tan apbn","Netral"
0,"permendag nasdem harga batas telur ayam ternak harga batas telur ayam ternak harga tingkat konsumen maksimal indogrosir jual ternak gaji","Netral"
-1,"pek harga telur ayam turun drastis","Negatif"
-1,"harga telur ayam ras anjlok","Negatif"
0,"bagai informasi harga telur murah","Netral"
0,"harga minyak masak harga telur ayam harga ayam menteri wfh","Netral"
-2,"telur pagi beli kilo ternak tani kasihan bangetharga cabe anjlok ternak ternak telur moga amal moga telur roket harga","Negatif"
1,"ganti menteri indogrosir murah harga telur ayam banding pasar mitra tani tan hak prerogatif presiden terima kasih presiden","Positif"
0,"presiden jokowi indogrosir harga telur ayam kg harga telur ayam pasar mitra tani tan kg presiden jokowi perhati rakyat sifat kicau","Netral"
-1,"presiden palai badan pangan nasional beritahu detik harga telur ayam kg indogrosir bawah harga kg telur ayam pasar mitra tani","Negatif"
0,"lajiao ngerasa spesial krna martabak telur harga","Netral"
0,"minyak mahal ayam mahal telur mahal takde sape kawal harga barang","Netral"
-2,"nak marah pergi beli ayam ayam mahal bajet ayam harga range lari bajet benci telur mahal rm eee benci ikan minyak toksah cakap beli minyak paket je rm","Negatif"
-5,"risau pulak jenguk manjung niaga nasik lemak polisterin penuh nasi lemak sambal tumis kacang goreng ikan bilis lambak telur rendang daging senduk penuh engkorang letak harga rm je","Negatif"
-1,"gila ayam kor kg rm harga telur gred papan rm menteri cemana","Negatif"
1,"fess masak kaya warung kopi harga murmer indomie telur jual","Positif"
-1,"simak harga telur ayam jakarta rendah rp kilogram","Negatif"
-1,"harga telur rataratadibanderol rp kilogram harga tinggi banderol rp kilogram rendah rp","Negatif"
0,"harga telur","Netral"
-2,"harga telur kesini anjlok gila harga ternak tetep waras","Negatif"
0,"pagi cari nasi kerabu harga rm telur masin nikmat dusta hihi","Netral"
1,"pempek radial asli palembang pempek lem telor lenjer ada lenjer kulit paket harga jangkau minat order dm","Positif"
-1,"harga telur anjlok ternak tombok minus juta rupiah","Negatif"
0,"barang harga telor bebek butir daerah","Netral"
-1,"jerit ternak ayam harga telur anjlok pakan mahal tambah ppkm","Negatif"
0,"harga telur jatuh telur ayam ras telur bebek stabil kayak ngejual telur bebek tolong harga jatuh asin telur ayam ras untung kmaren ternak ayam ras","Netral"
-1,"murah harga lele sahaja lepas gift butir telur berbaloi beli","Negatif"
1,"makan kantin denger cakap gin pakai sayur lodeh bang pakai ayam paha habis telor dadar ehm pakai sambel pakai kerupuk bang harga kerupuk langgan","Positif"
-1,"inilahtasik harga telor ayam anjlok ternak ancam gulung tikar","Negatif"
-1,"bentuk protes faedah ternak ayam telur anjlok harga telur moga harga pulih","Negatif"
1,"bm contoh telor saiz eharga saiz minyak masak botol rm sahaja barangan makan harga ink printer pon rm alas ringgit kukuh","Positif"
-2,"maggi goreng ayam double telur air soya vsoy total rm lepak mamak lupa harga hahahahahaahahahahaha","Negatif"
-1,"harga cecah rmkg kg udang gram je berat kulit kulit udang sesuai jadi makan tambah makan utama salah guna kulit udang terang warna kuning telur","Negatif"
-2,"ternak jerit lantar harga pakan ayam roket harga telur anjlok buruk","Negatif"
0,"selamat sore harga siomay pcs bahan dasar ikan tuna lengkap telur pcs kentang kubis pare pcs masingmasing monggo parak rasa menumenu penasaran","Netral"
-1,"harga telur anjlok","Negatif"
-1,"harga telur ayam anjlok ternak ancam gulung tikar","Negatif"
-1,"harga telur anjlok ternak tombok","Negatif"
-4,"ppkm kelar harga telur anjlok faterna ppkm panjang dampak buruk terna khusus unggas akibat harga telur turun rugi ternak ayam","Negatif"
1,"harga telur turun beli sayang harga minyak diskon","Positif"
-1,"hubung harga telur anjlok gulung tikarga nyambung","Negatif"
1,"pempek radial asli palembang pempek lem telor lenjer ada lenjer kulit paket harga jangkau minat order dm","Positif"
-1,"harga telur ayam anjlok ternak kabupaten blitar gulung tikar","Negatif"
-1,"harga telur anjlok ternak lamongan kibar bendera putih","Negatif"
0,"telur gulung jual jalan umnya dibandrol harga rp rp","Netral"
-1,"harga telur anjlok ternak ayam telur boyolali kolaps","Negatif"
-2,"harga telur ayam anjlok ternak rugi rp kg via","Negatif"
-2,"harga telur ayam anjlok ternak rugi rp kg","Negatif"
-2,"harga telur ayam anjlok ternak rugi rp kg","Negatif"
-1,"harga telur anjlok ternak boyolali jerit tombok puluh juta","Negatif"
0,"makan murce daerah jaksel cobain beef gyu menu beef gyu abur daging telor ceplok harga asli pakai promo syopifud disc maks lupa claim ongkos kirim total cuman emejing","Netral"
0,"bataras harga ayam sen daging allana gm rm rm telur gred nampak haritu habis beli","Netral"
-1,"tido tolong kawal harga ayam telur harga ayam gila kilo rm tolong niaga mcm nak jual mcm nak jual mahal beli jual harga utg mcm takde turun padang","Negatif"
-1,"fess open order ekado isi telur puyuh balut daging ayam isi mozarella harga kpack pcs dom malang ongkos kirim via shopee mesan dm","Negatif"
0,"telur harga ehgrade harga grade aand im using grade ringgit beza menteri kpdn tido kee","Netral"
0,"dewi harga telur amlek harga daging ayam hancur ternak mohon harga jagung wajar sopan tulis president pas baca tangkap lepas keri","Netral"
0,"borong telor selagi harga turun","Netral"
0,"mrt hukum ekonomi tahu ternak butuh pakan supplier pakan main ternak nambah supplier nambah harga harga telur murah supply telur pasar butuh","Netral"
0,"harga telur turun harga pakan","Netral"
1,"ternak ayam jokowi menang bangkrut solusi harga telur ayam roket cuman ekspresi aman tv","Positif"
-1,"jahanam harga telur gred rm mahal waknat","Negatif"
0,"banget kemarin harga telor murah banget kirain telor","Netral"
-2,"harga telor kandang ribu bangkrut","Negatif"
1,"salah ndertpi perintah mmberikan solusi turun harga telur butuh pokok tani cabe harga jual murah beri ringan pupukpembelian lngsung tani ternak win win solution","Positif"
0,"restoran dcoral best jugak abang harga patut sedap abang order ketam telur masin udang butter ikan stim lemon kedai nice kat sungai jambat kuala selangor rumah api","Netral"
0,"anjlok harga komoditas telur ayam ternak membagibagi gratis telur masyarakat potret","Netral"
0,"anjlok harga komoditas telur ayam ternak membagibagi gratis telur masyarakat potret","Netral"
0,"nasi ayam rp nasi ayam telur rp nasi lele rp nasi lele telur rp harga telur","Netral"
-2,"tetiba banget surabi subang dibawain ikii surabi telor oncom sambelnyaaaa hhhh cari tidak ada uang jahat kelamin sambel bayar sm huhu enyaaak mas angett bayar harga lop syopifudd","Negatif"
-1,"mrt era presiden pakan ternak mahal ternak gulung tikar sebab salah satu harga pakan kian mahal harga telur kadang murah langka pupuk","Negatif"
0,"nyesuaiin harga pakai telor asih ayam dikecilin","Netral"
0,"jual telur lesu harga turun pasar manis","Netral"
-2,"yb berat bangkit isu harga makan asas kawal tingkat harga telur bayam ayam etc","Negatif"
0,"komoditas alami turun harga cabe merah keriting cabe rawit hijau cabe rawit merah bawang merah","Netral"
0,"dasar pantau harga pasar rakyat kota bandung harga ratarata butuh pokok jumat september komoditas alami naik harga telur ayam broiler ikan kembung","Netral"
-1,"thats harga ayam telur ayam players than feedstuffs imported nak expect padia kpdnhep letak harga siling ramai laaaa penternak ayam sederhana lingkup","Negatif"
0,"mbak gabah murah iling padi tutup efek harga bekatul imbas harga pakan ternak banding harga telur","Netral"
-1,"ternak buka buka picu anjlok harga telur","Negatif"
0,"harga bahan mahal telur kasi dikit","Netral"
0,"ternak poster bantu harga jagung wajar butuh pakan ternak kait komunitas ternak pribadi kelimpungan harga telur jatuh pakan mahal kasih sembilan bahan pokok","Netral"
0,"harga telur lorot ternak ayam kulon progo rugi baca jogja","Netral"
-1,"perintah gelem ngurusi receh koyo ngene ndor harga telur asline turun ndor cuman bareng harga jagung gila pakan ayam telur bahan jagung giling","Negatif"
1,"september penen benih telur gurami pokdakan mina jaya persada desa sumber agung camat sungai gelam kabupaten muaro jambi harga benih rp ekor","Positif"
0,"kafirnw harga telur terjun bebas kasihan ternak ayam telur","Netral"
-1,"kafirnw mmg kasihan ternak ayam telur harga telur murah","Negatif"
0,"dalem kinderjoy ambil harga kinderjoy mahal harga telur","Netral"
0,"harga telur ayam mahal nak mampus","Netral"
0,"mampus nganga je jenguk harga telur masuk jugak troli bagai ikut mmg nak","Netral"
0,"harga telur ayam naik nampak turun remember last year beli telur rm now last week harga telur literally same type brand harga rm","Netral"
-1,"telor asin ganti tempe itu range harga","Negatif"
1,"fess rate harga kotak gin dom jombang ngomong-ngomong kotak ayam telur asin mahal ku harga modal rban ku ngedumel buatin kasih harga","Positif"
-2,"saing ternak populasi kandang bawah ekor bingung buang telur serampang buang telur harga murah telur cepat angkat kandang harga pasar kontrol","Negatif"
0,"ternak ayam bantu sembilan bahan pokok segitunya jokowi susah harga pakan harga telur turun ternak level bantu sembilan bahan pokok bantu ternak kasih sembilan bahan pokok","Netral"
