"score","text","klasifikasi"
1,"import lokal harga sama harga modal subsidi harga jual ayam telur murah ribu ribu sdgkan mandiri harga ayam telur ribu ribu kilo","Positif"
0,"lindung tani jagung lokal dsn ternak ayam telur harga jagung lokal merugijan tani jagung rugi sesuai jual rugi sdgkan ternak harga ayam telur tetap","Netral"
2,"id emak erti politik emak tau harga telor turun harga jagung suka bandingin harga ecommerce nemuin jual jual harga murah tawar","Positif"
0,"blitar ternak ayam keluh turun hargatelur","Netral"
0,"harga jagung ternak telur harga jagung tani","Netral"
1,"harga telur prediksi rp kg jakarta tahan gara daya beli ambruk","Positif"
0,"ko neng harga telur turun abis kemarin mahal banget","Netral"
0,"ternak ayam keluh harga telur turun","Netral"
0,"siregar harga telur turun lakuartinya daya beli turun","Netral"
0,"oversupply harga telor jatuh solusi biaya produksi rangin harga jagung diturunin untung besok ternak perang harga","Netral"
1,"tanggerang september kirim harga telur blitar terima kota tanggerang harga rp sekian terimakasih","Positif"
0,"ternak ayam kabupaten blitar keluh harga telur ayam turun harga rp kilogram senin","Netral"
1,"bandung september kirim harga telur blitar terima kota bandung harga rp sekian terimakasih","Positif"
0,"wilgoz manteb selagi harga telur murah konten resep bahan telur","Netral"
0,"dagang telur pinggir jalan jual telur harga murah perkgnya","Netral"
0,"ternak ayam blitar keluh harga telur turun","Netral"
-2,"harga telur gantung harga pisang gantung stimulus","Negatif"
2,"nasib ternak ayam telur baik harga telur turun jagung pakan ternak mahal","Positif"
0,"harga telur tempat","Netral"
0,"anggota dpr singgung harga telur rapat tan","Netral"
-1,"harga telur turun gilir harga ayam kampung anjlok","Negatif"
-2,"ternak ayam telur kabupaten majalengka gelisah akibat anjlok harga telur pasar","Negatif"
2,"nasib ternak ayam kabupaten blitar jawa timur ubah undang presiden jokowi rabu harga telur ayam turun pakan mahal","Positif"
0,"harga cabai telur jagung kedelai gaduh kabar tan","Netral"
2,"nasib ternak ayam kabupaten blitar jawa timur ubah undang presiden jokowi rabu harga telur ayam turun pakan mahal","Positif"
0,"harga telur murah","Netral"
0,"alhamdulilahnanti ujung harga telur nihwaktu harga cabe hancur banget tuhkemendes kmana yaabnyak mslah lapang nihharga jagung telur cabe","Netral"
0,"harga telur turun pemkab sidrap rapat koordinasi cari solusi","Netral"
0,"ternak ayam blitar keluh harga telur turun","Netral"
-2,"ternak ayam telur kabupaten majalengka gelisah akibat anjlok harga telur pasar","Negatif"
-1,"harga telur kian merosot ternak pandemi alas","Negatif"
1,"harga telor daging fluktuatif rugi untung rugi untung jarna perintah jaga stabilisasi harga pakan fluktuasi ekonomis produksi konsumsi daya beli gantung pasar maaf pura pura amat sok zamin akurat","Positif"
-1,"sudahulai turun marin asosiasi ternak pimpin dpr sing ketemu pakde diseakati harga thun trend juli september jagung dagang jagung expert bep telor kandang","Negatif"
0,"belit harga jagung telur ternak ayam telur hadap jokowi","Netral"
2,"fess tinggal samarinda harga telor gulung ori sosisbakso dan lain langgan jual pramuka sd harga kayak nemu situ telor gulung asli samarinda sayang jual jarang malam","Positif"
0,"telur ayam turun nyampe kg hari inisebelum bansos jokowi turun harga kg efek beli perintah stok abisyang akibat stok dagang harga lonjak well bansos","Netral"
-1,"tebak harga porsi bubur ayam bawah ceker telor puyuh tusuk kulit","Negatif"
-4,"harga telur jatuh efisiensi protes harga jagung jagung butuh industri ayam emang ngerasa berat beli jagung ganti dedek makan ayam bayang harga jagung turun banget","Negatif"
-2,"jarang ternak ayam telur teriak harga teriak minta telur pandemi turun drastis laku usaha butuh telur kurang henti supply telur kantin kue restaurant dan lain","Negatif"
-2,"malu syahrul yasin limpo menteri tani daya ngatur harga cabai telur jagung kedelai","Negatif"
-1,"syahrul yasin limpo tan daya hadap skill strategi tengkulak pasar harga cabai harga telur ayam harga jagung ngatur harga becus","Negatif"
-2,"ternak ayam telur kabupaten majalengka gelisah akibat anjlok harga telur pasar","Negatif"
1,"rawan lamongan bantu ternak harga telur ayam terjun bebas","Positif"
1,"ayam ngan telur harga takdir tuhan","Positif"
0,"ipoh manjoi harga pricey nak hahahahaha haa gambo rm kot kot ketul tteokbokki sausage biji telur","Netral"
-1,"kemarin telor gulung mall harga takut mahal","Negatif"
-1,"fess open order ekado isi telur puyuh balut daging ayam isi mozarella harga isi telur puyuh kpcs isi mozarella kpcs dom malang ongkos kirim via shopee mesan dm","Negatif"
1,"pempek radial asli palembang pempek lem telor lenjer ada lenjer kulit paket harga jangkau minat order dm","Positif"
-1,"guis open order ekado isi telur puyuh balut daging ayam isi mozarella harga kpack pcs dom malang ongkos kirim via shopee mesan dm","Negatif"
1,"poin audiensi perintah bagai ikut telor bansos gtgt duit bansos aman bantu jagung harga ton gtgt diitung bulan butuh jt ayam","Positif"
-1,"coba bertubitubi kemarin telur gilir harga ayam kampung remuk dagang boyolali pasrah via solo","Negatif"
0,"raker harga telur pakan ternak komisi iv buang angin tuan","Netral"
1,"sesuai harga telur yen tolong","Positif"
-1,"siasat harga anjlok ternak lamongan bagibagi telur masyarakat butuh fokus harga telur pasar anjlok beda harga pakan ayam ternak blitar jawa timur terp","Negatif"
0,"sardin takde nak makan telur burger pulak nak harga","Netral"
-1,"harga telur harga ayam kampung anjlok","Negatif"
0,"harga telur rbkg hepiiii gercep nyetok","Netral"
0,"harga barang mahal nak expect harga zaman takde istilah makan marhaen sembang makan nasi telur kicap telur sarang rm","Netral"
-1,"coba bertubitubi kemarin telur gilir harga ayam kampung remuk dagang boyolali pasrah","Negatif"
0,"tekunin ternak ayam telur harga telur jeblok banget diliatliat","Netral"
-2,"timun sehiris telur belah harga nasi lemak","Negatif"
0,"skema sesai jangka pendek usul perintah oprasi pasar tekan harga pakan ternak usul perintah serap telur hasil ternak paket bansos","Netral"
0,"kemarin pasar subang informasi harga telor pintu kg","Netral"
0,"harga telor rp","Netral"
-1,"nama barang telur asin sarwosari segera mungkin kode barang harga isi butir","Negatif"
0,"nama barang telur asin sarwosari original kode barang harga isi butir","Netral"
0,"harga telur ayam lambung walaubagaimanapun dapat isi rumah kekal turun akibat pandemik","Netral"
-1,"malendra mana ributin indibauk malam ku ajak main harga latencynya asa ken ngajak gelud lambat sebentar diceplokin telor","Negatif"
0,"daftar harga butuh pokok jabar pekan senin september daging telur ayam turun","Netral"
0,"daftar harga butuh pokok jabar pekan senin september daging telur ayam turun","Netral"
-1,"harga telur canak baking gred dh murah gila jual harap cust paham lh telur je tepung coklat mcm haih","Negatif"
0,"dagang jerit telur ayam alami turun harga","Netral"
0,"harga ayam telur demand over supply","Netral"
0,"temu suroto tuju bentang poster tulis jokowi bantu ternak beli jagung harga wajar telur murah","Netral"
-2,"gatau faktor harga telor turun telor murah demand telor kota kota kurang telor sebar daerah daerah analisa bodoh rebu turun","Negatif"
-2,"harga telor anjlok ternak gultik ternak bangkrut harga pakan stay harga jual turun banyak turun makan mie pakai tidak ada uang telor business","Negatif"
2,"mitochiba magic chopper pasang pisau halus daging cepat kapasitas liter daya watt fungsi giling halus tumbuk kocok telur adon harga rp","Positif"
1,"mufc harusnyaa surosodi spanduk tulis turun harga telur harga telur jujur banget ungkap isi hati siasat pimpin","Positif"
0,"box simpan telur butir harga link","Netral"
0,"dasar pantau harga pasar rakyat kota bandung harga ratarata butuh pokok senin september komoditas alami turun harga daging ayam broilertelur ayam broilercabe merah keriting bawang merah","Netral"
1,"ubah iklim ubah naik harga butuh pokok siapsiap bawang cabai tomat beras gula garam telur dan terus istimewa langka","Positif"
0,"bayar sekian milyar bayar pakai barang harga pasar utang bayar pakai telor kg harga warung pas bayar ternak telur jual kepul harga beli pasar","Netral"
2,"bang menteri tolong harga telur tangan harga cabe terjun bebas urus sehat serah jabat perintah daerah kabupaten propinsi memang daerah pimpin urus tugas harga telur dan lain","Positif"
1,"pempek radial asli palembang pempek lem telor lenjer ada lenjer kulit paket harga jangkau minat order dm","Positif"
2,"steakholders kait regulasi tetap harga ecer tinggi produk industri sangga terna tani tetap het telor jamin usaha batas harga jagung tinggi kisar jagung terjun","Positif"
-4,"kilas rugi ternak telur sebab murah harga telur mahal harga jagung jagung butuh ternak gantung konsentrat doc obat obat vaksin harga sangata mahal kendali","Negatif"
-1,"sesal presiden putus instan tolong ternak telur korban tani ideal harga jagung tetap kisar kg tani oleh hasil jtbln tani beli telur","Negatif"
0,"sumpah kelakar benda melayu benda cakap letak telur letak telur save telur harga charge je dengki bijak letak","Netral"
0,"ngomong-ngomong harga telor kilo gajualan pantau toko telor","Netral"
1,"perempuan suka heboh langit pokok harga telor turun need this day","Positif"
1,"yallah kaya ovt melulu harga telor minggu beda minggu","Positif"
-2,"ceplok dadar ampir beda belah pdhl telor ceplok essential bayar harga mahal belah","Negatif"
-2,"sekolah rendah burger telur rm burger dagingayam rm burger special rm gila jalan harga burger","Negatif"
2,"olput pilih pilih tani jagung senyum harga jual jagung tingkat ternak unggas jerit pilih ternak unggas senyum harga jagung pakan ternak unggas turun pilih konsumen jerit harga telur daging unggas","Positif"
-1,"kedai tempt burger pon bincang nak naik harga hrga bahan mentah telur ayam ngn minyak","Negatif"
-4,"day sep gatau lupa sabtu kue hasil manis banget kacau malemnya bocil inap dua ramai kamar sobiku dateng nanyain harga wedding uuuuuuu sebentar genk pecah telor pict sajen bocil","Negatif"
2,"yahhh tenang mbak pecel ayam bebek usus kulit soto ayam tempe telor harga cocok kantong pas tanggal tua","Positif"
0,"harga telor turun bentuk tubuh maksimal asupan protein","Netral"
0,"coba makan telur slur variatif harga trjangkau slur","Netral"
2,"gratis fasilitas lengkap harga gratis habis besok bisul banyak makan telur","Positif"
-1,"pmt kg harga telur ayammya lotte grosir rp bawah harga batas ternak telur ayam indogrosir besok pesan mama tan reshuffle","Negatif"
-1,"jajan makan harga standar jogja beras kkg telur kkg telur kkg sayur anhari tempe papan biji beli beras kg telur kg sayur beli tidak apa tempe yok","Negatif"
-2,"jual harga nasi goreng makan bayangin nasi goreng telor ceplok harga lonjak sanasini gin naikin wajar banget recommended","Negatif"
0,"beli martabak langgan edisi tebal sedap heran kait telur harga rbkg","Netral"
-4,"mongomong nasi goreng jogja ku coba nasi goreng harga semangkok full pakai telur dadar tomat timun sambel muanteb goreng batok kelapa bakar masak anak smk jurus tata boga enaaak gila harga ttep","Negatif"
2,"tahan raja menteri kpdnhep mana harga ayam lambung harga telur ingat harga katak je mahal","Positif"
-4,"jagung harga mahalemak emak marah marahharga telor mahal emak emak marah marahharga daging ayam mahal emak emak marah marahbener benrr power emak emak susah erti","Negatif"
0,"telur mumpunh turun harga telur","Netral"
-1,"harga telor anjlok banget kasi ternak","Negatif"
0,"semarang jual telur keliling harga kg","Netral"
1,"being pikir endoglover bahagia harga telor murah murah gin kasi ternak","Positif"
0,"sisa luar listrik air kompor listrik rice cooker masak putar telurtofujamurayam potongrange harga protein pasar pls supermarket sayur","Netral"
0,"ada respon fenomena harga telur biar ada program darurat tri hebat mlutfi urus mall kmrin utama benah direshuffle menteri","Netral"
1,"jawab harga telor murah serbu impor","Positif"
-1,"beli telur solo harga kandang","Negatif"
0,"ternak ayam putar harga pakan harga telur daging ayam jaman suharto sekaranguntung suroto ketemu jkw perhati menteri solosi","Netral"
-1,"harga nasi goreng porsi murah cuman makan masak beras tinggal beli telor kg bumbu habis","Negatif"
2,"tan mendag koordinasi urus harga jagung harga telur ayam koordinasi barang langka negeri selesai aku prestasi buru maju","Positif"
-2,"surabaya rbkg sedih kadang liat harga telur hancur","Negatif"
-2,"minggu kliling ternak blitar diri harga telor kandang rp rbkg","Negatif"
-1,"telur ayam negeri ecer rpkg bsd harga kandang","Negatif"
2,"kurakura kasih sayur gilir kasih ayam telur omega diabisin curiga diemdiem suka googling harga bahan pangan","Positif"
1,"pempek radial asli palembang pempek lem telor lenjer ada lenjer kulit paket harga jangkau minat order dm","Positif"
0,"cerita malam keluh harga gabah telur turun mengsedih bisaki","Netral"
0,"harga injun batas makan ngomong-ngomong cilor telur gulung tauu","Netral"
0,"telor harga","Netral"
0,"harga telor turun harga martabak special ribu","Netral"
-3,"nasi goreng diri daerah bratang surabaya suka nasi goreng cenderung manis sippp harga pelit telor","Negatif"
0,"telor asin bahan baku telor bebek pilih garam yodium merek arjuna ireng isi kemas butir pack sertifikat iumk pkp harga kemas rp telor asin rebus rp telor asin bakar daerah produksi jakarta timur mesan","Netral"
-1,"mimpi semalem harga telur kkg shock banget sumpah pas harga jalan","Negatif"
0,"faktor sii harga jagung korelasi naik hrga jagung harga telur sikap tani jagung harap hrga jagung stabil ujung impor kasi tani jagung","Netral"
-1,"pecel mbak pur jalan nusa barong harga pakai telur sambel pecel kentel sayur kreskres sabtuminggu ramai poll","Negatif"
0,"contoh jual nasi lemak timun telur jual nasi minyak dagang acar timun jual kuih karipap inti angin too small harga mahal jual kuih burger malaysia without enough sambal timun","Netral"
-2,"perintah harga telur daging merosot ulang solusi","Negatif"
1,"harga telur ayam ras minggu september harga stabil aksaraintimes","Positif"
-1,"ternak tuju harga pakan banding sm harga telur kualitas pakan jelek banget skrng ternak gulung tikar simalakama impor ternak bantu tani impor ternak mati","Negatif"
0,"top news koran rakyat merdeka pulang istana suroto digeruduk emakemak harga jagung turun nunggu","Netral"
1,"harga jagung turun harga telur stabil","Positif"
0,"siregar fatih anakkolong mrt juang ri sajak indikasi adadaya beli masyarakat menurunharga telor turun beli dilapangancebong senggama kolam","Netral"
1,"fess harga dijogja nasi box lauk ayam paha sambel grng krecektelur gudeg buah pisang snacknya lemper risol kacang mama jual tawar beli","Positif"
1,"bandung september kirim harga telur blitar terima kota bandung harga rp sekian terimakasih","Positif"
1,"pempek radial asli palembang pempek lem telor lenjer ada lenjer kulit paket harga jangkau minat order dm","Positif"
0,"anggap tinggal gaji tanggal telur kg butir beras kg grade indomie bks tempe balok tepung tempe cabe bamer baput kangkung bayem total harga jakarta","Netral"
-1,"telor harga mati","Negatif"
0,"tuju bgi badan khas kawal harga mcm ikan sayur telur belacan make sure mnde tk perform bazirkan duit rakyat errr tiberr","Netral"
0,"masak anggap gas listrik mas beli beras kg harga mahal warung rbkg telur kg rprb isi butir sisa pegang harihari","Netral"
-1,"coba hidup masak beras liter makan minggu butuh liter liter harga telur kilo isi biji ayam salah ekor total sisa bumbu ngerokok","Negatif"
-1,"guis open order ekado isi telur puyuh balut daging ayam isi mozarella harga kpack pcs dom malang ongkos kirim via shopee mesan dm","Negatif"
1,"purwakarta september kirim harga telur blitar terima kota purwakarta harga rp sekian terimakasih","Positif"
1,"karawang timur september kirim harga telur blitar terima kota karawang timur harga rp sekian terimakasih","Positif"
-1,"fess open order ekado isi telur puyuh balut daging ayam isi mozarella harga isi telur puyuh kpcs isi mozarella kpcs dom malang ongkos kirim via shopee mesan dm","Negatif"
0,"mesti cobain nasi telor super spesial pedas warung mama gofood harga","Netral"
0,"pedes astha jual pesan astha tuan rogoh saku uang lembar pas harga telor gulung beli","Netral"
-2,"harga telur anjlok telur ginu ternak pusing","Negatif"
-2,"anjlok harga telur ayam ras cek harga lengkap","Negatif"
-1,"ayam mahal sila makan benda ayam pasar basah mahal sila beli pasaraya igau makan ayam punca naik harga ayam teluranak ayamdll nyata keluar akan faham isu benar realiti","Negatif"
0,"beli telur selagi harga hancur bawang putih kecap manis makan minggu","Netral"
-1,"masak nasi beli cik harga ribu beli telor biji campur daun bawang beli tempe batu es","Negatif"
1,"pempek radial asli palembang pempek lem telor lenjer ada lenjer kulit paket harga jangkau minat order dm","Positif"
0,"harga telur turun kota pasuruan rp ribu","Netral"
-3,"syahrul yasin limpo menteri tani omong daya tengkulak pasar kalah skill bandar harga telur ayam harga cabai harga jagung ngatur harga becus","Negatif"
0,"tgk tgk harga brgn mknn ayam sayur telur ikan telur ayam pon harga ampon borong confirm mknn harga projek mega tunggu larakyat jaga","Netral"
0,"nasi tempe telur kecap cabe iris kuat tempe beli papan harga papan telur beli kg kecap refill cabe beli pasar","Netral"
0,"jagung turun olh harga telur harga pakan main lgkah","Netral"
0,"harga pakan patok tutun otomatis harga telur tutun bagai ikut biaya produksi turun","Netral"
-1,"patut penuh ayam telur ayam daging harga tue daging ayam konfius nsk","Negatif"
-1,"tolong harga telur ayam ras anjlok rp kg","Negatif"
1,"stok bahan pokok aman mendag harga beras telur turun","Positif"
0,"habis harga ikan mahal sardin mahal telur mahal nak suruh makan","Netral"
-3,"ungkap suroto bantu ternak beli jagung harga wajar ayam pellung rumah makan jagung rutin beli jagung harga jagung pasar rpkg sisi harga ayam telur murah ttp pakan ayam mahal ternak unggas alami rugi","Negatif"
2,"makan warung tegal pepet jual langgan kenal gratis beli pakai lauk telur bokek gaji lgs kasih ayamempal jagung sayur lengkapharga normal","Positif"
0,"harga telur turun harga jagung sorot harga bibit langit sorot supply demand pikir","Netral"
1,"suda nangkring biasah manteman spesial nasi bakar tongkol telur asinharga kaya ayam jamur semuaahh","Positif"
-2,"harga ayam minyak telur barang essential pulak jenis menteri makan gaji buta nak menteri settle bodo anjing","Negatif"
-1,"viral klaten harga anjlok pria curi telur dan aksi rekam cctv","Negatif"
-2,"ternak ayam telur lampung aku rugi rp juta garagara naik harga pakan jagung harga telur anjlok","Negatif"
1,"kiim telor sehat nduk harga pakan standard harga telor","Positif"
3,"mudah lantik nasihat ekonomi bantu skg harga barang mentahmakananayamtelur harap dsn bantu great job far pm hooe continue bring prosperity improve economy terima kasih dsis dsn","Positif"
1,"ayam kilo sosis oke telur kg tempe beli sayur sisa gatau harga sayur cuman tinggal banget minggu","Positif"
-1,"sadfood mahal range gantung telor sender sen spesial banget harga segitu","Negatif"
1,"pempek radial asli palembang pempek lem telor lenjer ada lenjer kulit paket harga jangkau minat order dm","Positif"
-3,"mie goreng pakai telor mie goreng es kakak perempuan kopi es batu gelas total harga harga nyata cinta salah total buru bayar harga mie serta minum","Negatif"
0,"harga telor ancuran","Netral"
-1,"viral klaten harga anjlok pria curi telur dan aksi rekam cctv","Negatif"
0,"bantal sofa telor ceplok harga rp link","Netral"
-2,"dari tadi scroll grabgojekshopeetraveloka bandingin harga makan murah bingung gajadi goreng telor ajeh pressure banget bgst","Negatif"
1,"ning bagi telur ayam warga desa plandaan kabupaten jombang gera dorong upaya bantu ternak ayam telur lokal kabupaten jombang ternak ayam telur alami turun harga telur tinggi angka pakan ternak","Positif"
0,"ngomong-ngomong menu nasi goreng rempah ribu harga offline telor ceplok dadar cocok makan daging lema","Netral"
0,"maghrib buru telur harga telur kg depan telur telur telur","Netral"
0,"probolinggo ternak telur ayam jerit harga telurturun","Netral"
0,"harga telur ayam terjun bebas ternak resah","Netral"
0,"once upon time harga telur tingkat dadak dadak menteri arah","Netral"
0,"suroto temu presiden harga telur turun","Netral"
-1,"keluh ternak harga telur merosot penyetabilan harga telor harga jagung turun","Negatif"
-1,"telur pulau jawa bal serbu lombok timur ntb sebab harga telur anjlok kondisi sebab ternak lotim protes sweeping","Negatif"
1,"harga wajar mesti liat daerah harga variasi telor start make sense martabak angka segitu","Positif"
-1,"telur lokasi worth worth gantung jakarta harga standar","Negatif"
-1,"fess open order ekado isi telur puyuh balut daging ayam isi mozarella harga isi telur puyuh kpcs isi mozarella kpcs dom malang ongkos kirim via shopee mesan dm","Negatif"
-1,"guis open order ekado isi telur puyuh balut daging ayam isi mozarella harga kpack pcs dom malang ongkos kirim via shopee mesan dm","Negatif"
1,"majalengka september kirim harga telur blitar terima kota majalengka harga rp sekian terimakasih","Positif"
-4,"harga telur anjlok ternak dilema hidup segan mati","Negatif"
0,"kaget denger harga telur kilo","Netral"
-1,"supplier telur pasar kota pasuruan idham aku anjlok harga telur juli kemarin video","Negatif"
-3,"suroto presiden jokowi bantu pecah hadap ternak harga jagung cenderung harga telur rendah","Negatif"
0,"temu suroto tuju bentang poster tulis jokowi bantu ternak beli jagung harga wajar telur murah","Netral"
-1,"jakarta lupa makan telur harga telur sejahtera ternak indonesia","Negatif"
0,"bedah problematika harga telur ayam kunjung","Netral"
-3,"ungkap suroto bantu ternak beli jagung harga wajar ayam pellung rumah makan jagung rutin beli jagung harga jagung pasar rpkg sisi harga ayam telur murah ttp pakan ayam mahal ternak unggas rugi","Negatif"
0,"harga telur ayam lotte grosir meruya kg kg harga telur ayam indogrosir murah harga lotte grosir","Netral"
0,"batas tingkat ternak permendag mama member merah indogrosir saran member indogrosir harga telur ayam murah","Netral"
-2,"harga telur ayam indogrosir bawah harga batas tingkat ternak permendag wajar ternak gaji harga telur ayam lotte grosir meruya mahal harga indogrosir bawah harga","Negatif"
-1,"harga telor tempat kg kemarin beli kg harga telor turun drastis harga minyak turun harga","Negatif"
0,"mama turun harga jual telur ayam kg","Netral"
0,"telur ayam indogrosir harga jual telur ayam toko mama","Netral"
0,"sayang harga telor titik rendah","Netral"
-2,"nekat bentang poster temu wakil himpun insan unggas ternak ayam telur suroto presiden bantu ternak beli jagung harga wajar harga telur rendah percaya satusatunya indonesia tolong ternak","Negatif"
1,"pempek radial asli palembang pempek lem telor lenjer ada lenjer kulit paket harga jangkau minat order dm","Positif"
1,"makan asas ayam segar telur ikan harga netizen gelupur mua service make up fazura rm baju kahwin fully chiffon full beading custommade harga budget rm habis niaga nak makan","Positif"
-1,"bang pakai ayam pakai telor pakai kerupuk engga bang harga kerupuk beli spotify premium","Negatif"
-2,"harga telur anjlok dagang laba maling guling rumah koran online sep","Negatif"
0,"sebentar harga telur gelar hajat","Netral"
0,"syahrul yasin limpo tan planga plongo daya hadap tengkulak pasar planga plongoharga harga cabai harga telur ayam harga jagung","Netral"
0,"dagang laba harga telur kota pasuruan turun rp ribu kilogram","Netral"
-1,"prediksi harga telur ayam jual indogrosir turun membernya jual telur ayam beli harga telur ayam member rendah harga jual pasar mitra tani telur ayam","Negatif"
0,"presiden jokowi panggil tan menteri nasdem kait telur ayam presiden jokowi jual telur ayam harga jual telur ayam pasar mitra tani tan beritahu beli indogrosir","Netral"
0,"main buka harga jual telur ayam telur ayam indogrosir jual kg harga jual pasar mitra tani","Netral"
1,"indogrosir harga murah telur ayam membernya beli bagus indogrosir sangka membernya beli sama harga jual telur ayam pasar mitra tani","Positif"
4,"tetangga ucap terima kasih ucap terima kasih indogrosir harga telur ayam murah","Positif"
0,"telur ayam indogrosir harga jual toko harga jual pasar mitra tani harga batas ternak telur ayam permendag atur menteri dagang","Netral"
0,"telur ayam indogrosir tetangga kota bambu harga telur batas ternak kg jual pasar mitra tani","Netral"
0,"telur ayam negeri turun harga rp kg","Netral"
-1,"harga jagung murah tani jagung kasihan ujung import solusi batas produksi telur harga telur","Negatif"
1,"almarhum bapak beliau guru agama islam sman caruban gaji guru beliau ternak ayam telur dengar keluh kesah makan ayam mahal harga telur turun semangat suroto","Positif"
0,"bawa poster harga telur naik panggil istana bawa poster kpk benah panggil istana","Netral"
-1,"rakyat pas harga minyak gin tutorial ngegoreng telor ceplok minyak salah satu pakai daun pisang","Negatif"
-1,"pagi pagi cek harga telur sayurbox bal murah cuz cekout biji ongkos kirim sebenernya bayar bayar pakai ovopoints biji gila hemat banget","Negatif"
0,"ktna stabilisasi harga pakan telur solusi menteri tani idnchannel pandemi covid pukul harga jagung dunia imbas naik harga pakan negeri","Netral"
3,"permisi numpang lapak mimin open pastel isi kentang wortel bihun telur matang harga pcs minimal order pcs kirim mesan kirim jakarta timur dm terima kasih","Positif"
0,"bahagia naspad deket rumah harga flat lauk telurperkedel","Netral"
-1,"siput sedut sotong rendam mahal ikan selar takyah cerita kerang harga kayangan sotong ketam fuhharga ikan bilis kejam telur ayam je mcm layak beli dim anak anak","Negatif"
-3,"suroto presiden bantu pecah hadap ternak harga jagung cenderung harga telur rendah percaya satu indonesia tolong ternak jokowi suroto temu","Negatif"
