"score","text","klasifikasi"
-1,"harga telur ayam peti anjlok ribu","Negatif"
0,"harga telur ayam rbkg","Netral"
-1,"sedih banget bulan jual telur ayam tipis banget untung harga pasar anjlok moga berita","Negatif"
-2,"harga telur anjlok ternak rugi","Negatif"
0,"harga telor turun ternak ayam telur ribut cacing kepanasanharga telor ternak telor senang ketolongankalau tanam kelapa panen","Netral"
0,"coba dibagiin harga telur mahal","Netral"
0,"harga telur rakyat jerit","Netral"
1,"open preorder pempek khas palembang produksi palembang asli harga telur lenjer ada kulit cuko packing vacuum kirim indonesia repdm fess","Positif"
0,"harga telur anjlok ternak jerit harga bibit jagung lonjak makampteam bantu bibit gratis bantu pasar sistem mitra","Netral"
0,"harga telur anjlok ternak telur gratis via","Netral"
1,"open preorder pempek khas palembang produksi palembang asli harga telur lenjer ada kulit cuko packing vacuum kirim indonesia repdm guis","Positif"
0,"harga telur anjlok ternak telur gratis","Netral"
-2,"harga ayam kg hurahura harga telur turun orak salah perintah","Negatif"
0,"bus jib haritu dengar closed makan sedapppp harga nak sembelih tengkuk telur dadar je won makan pejam je tak","Netral"
3,"dagang untung rugi harga ayam telur turun rakyat syukur terima kasih beli ayam telur harga murah makan gugat jokowi menteri","Positif"
0,"pantes kemarenan emak beli telor banget makan suruh pakai telor turun harga telor","Netral"
0,"fess larisin dagang ayah wedang jahe merah asli martabak telor ayam bebek sosis pisang keju harga murah start dateng layan bekas barat depan jojo photocopy maps ketik cont","Netral"
1,"masak pandai masak maggi telur telur cantik je pecah sudah mmg perencah sepah plastik maggi sadai kuah maggi titik tertawa harga sedap masak","Positif"
0,"harga ayamtelor lambung tingi mengugat srimulat banget saudara laki brooo","Netral"
-1,"fess harga sostel sosis telur viral harga ibu jual bingung harga ibu jual bekas ngomong-ngomong kasih harga daerah sostel","Negatif"
1,"kenal kerupuk telor asin kerupuk telor asin tepung tapioka bumbu gurih asa telor asin kemas gram gram harga kemas rp ribu produksi kirim surabaya mesan via","Positif"
0,"harga telur ternak susah senang","Netral"
0,"harga telur murah kreasi menu donat sase lovers endul","Netral"
0,"pergi desaru mmg makan je harga berbaloi potion makan sotong telur masin die terbaikmemang wajib cuba restoren","Netral"
-1,"dagang bingung harga daging ayam harga telur alami turun fokus harga daging ayam dagang ayam pasar tradisional kutoarjo purworejo minat masyarakat","Negatif"
-1,"fess open order ekado isi telur puyuh balut daging ayam isi mozarella harga kpack pcs dom malang disc ongkos kirim order mesan dm","Negatif"
0,"beli telor pas kemarin harga","Netral"
-1,"parapeternakdi blitar gelar aksi prihatin anjlok hargatelur ayamyang lanjut gelar bazar telur bagi telur ayamgratiskepada warga baca lengkap","Negatif"
-2,"naik harga pakan ayam parah turun harga telur ayam tingkat ternak harga telur pasar turun drastis rp ribu kilogram rp ribu kilogram","Negatif"
-1,"ratus ternak tengah magetan gulung tikar dampak harga telur merosot","Negatif"
-2,"produksi tingkat harga telur pasar anjlok saksi lengkap","Negatif"
0,"kecewa harga anjlok ternak laku demo bagi ribu telur ekor ayam gratis","Netral"
-1,"harga telur anjlok ternak ayam bondowoso afkir turun kualitaspakan","Negatif"
-1,"ayam ngudi rahayu porsi nasi ayam sate usus sate kulit sate telur puyuh kol goreng total atas porsi mie kocok nanang tea harga dikit beli mcd justus","Negatif"
0,"esok buka menu nasi putih daging masak merah telur harga rm sahaja buka pax jemput order","Netral"
0,"pempek isi telur harga pcs","Netral"
0,"pempek isi telur harga pcs","Netral"
-1,"harga telur anjlok rp ribu kilogram","Negatif"
-1,"bentuk protes harga anjlok dagang bagi ton telur warga","Negatif"
1,"roti janji jiwa beli telor murah subway beli roti harga rutin","Positif"
3,"kotak makan harga plus plus bekel telor balado huhu menang dompet ini","Positif"
0,"harga telor turun harga diem wae","Netral"
0,"kaget banget makan kantor nasi telor mkst makan lauk mirah pas harga shock anj","Netral"
0,"siang open lusa oktober menu ayam geprek bowl ayam geprek kulit box rekues pedes pedes banget ayam telur mayo pilih garlic creamy spicy harga porsi order via","Netral"
1,"harga daging ayam capai kisar rban kilo kontras sm harga telur anjlok kilo logika tanda harga pakan sabar nggih terna ayam telur","Positif"
-1,"harga telur hancur pprn pusat blitar gugat rp triliun","Negatif"
0,"presiden harga telur anjlokgugat presiden","Netral"
-2,"protes harga anjlok kerumun demo ternak bagibagi telur gratis bubar tugas lengkap","Negatif"
0,"harga murah stok limpah ternak blitar raya bagi telur gartis informasi lengkap","Netral"
-3,"harga telur ayam alami turun daerah masjid hudal islam pondokgede bekas harga kian sentuh level rendah rp ribu kilogram lengkap fm profesional rri amd","Negatif"
-4,"kapok beli telor dagang harga miring pas pecah kuning pecah gabisa kue","Negatif"
1,"pempek radial asli palembang pempek lem telor lenjer ada lenjer kulit paket harga jangkau minat order dm","Positif"
0,"dasar pantau harga pasar rakyat kota bandung harga ratarata butuh pokok rabu september komoditas alami naik harga telur ayam broiler cabe merah keriting cabe merah","Netral"
-1,"harga telur ternak rendah integrator eks telur butuh pokok kena pajak","Negatif"
-3,"kemarin daerah rumah geger telur ayam hidup bentuk protes ternak mahal harga pakan harga jual telur anjlog rusuh","Negatif"
0,"protes mahal harga pakan ternak blitar bagibagi telur gratis","Netral"
0,"nasi bungkus lauk cuman telor dadar kibulin harga coyyy","Netral"
-1,"harga telor mudun tuku panggah rbkg bakul belah","Negatif"
-1,"wawancara direktur jenderal dagang negeri tri dagang oke nurwan kait ungkap harga telor anjlok lengkap fm profesional rri amd","Negatif"
0,"hmmmm buibu pulang pasar harga telor turun bu","Netral"
-2,"goda berat lelaki wanita goda berat wanita harga tahta lazada shopee seblak cimol batagor telur gulung siomay boba","Negatif"
-2,"sisi konsumen rumah tangga senang turun harga telor sisi ternak jerit untung alami kondisi tani telor busuk lempar kelola negara becus urus","Negatif"
-2,"ketua asosiasi ternak layer nasional musbar mesdi harga telur anjlok akibat terap ppkm harga pakan ayam lonjak lengkap dengar profesional rri","Negatif"
0,"ribu kg this guy said harga produksi telur ribu","Netral"
-2,"salut bngt sm ternak kecewa harga telor anjlok bentuk protes telor","Negatif"
-2,"kasihan ternak ayam harga telur anjlok jerit","Negatif"
-2,"ketua asosiasi ternak layer nasional musbar mesdi bahas anjlok harga telur pasar lengkap dengar profesional rri","Negatif"
0,"uang banyakharga barang biaya produksi mahal harga barang nilai uang turun inflasi kaya zimbabwe beli telur bawa uang koper","Netral"
3,"mantap harga telur lumayan oke contoh mikro garagara jagung rembet telur","Positif"
2,"kemendag pikir harga telur stabil daya beli masyarakat jaga jaga stabilitas harga telur baik telur ternak serap bansos lawan pandemi","Positif"
0,"harga telur pakan telur turun hargapakan turun","Netral"
0,"pantes harga telor kilo kg tinggi","Netral"
0,"protes harga turun ternak magetan bagi telur cumacuma","Netral"
-1,"harga telur anjlok ternak ponorogo gelar bazar kantor dewan","Negatif"
-2,"polisi bubar aksi bagibagi telur protes harga anjlok","Negatif"
1,"jokowi profesional ternak baik harga telur ternak serap bansos","Positif"
1,"bogor september kirim harga telur blitar terima kota bogor harga rp sekian terimakasih","Positif"
1,"harga telur gulir turun heran telur ayam beneran heee","Positif"
0,"makan malam barusan telor tebak harga","Netral"
-1,"kejap blitar laut demonstran akibat harga telur hancur","Negatif"
-1,"kejap blitar laut demonstran akibat harga telur hancur","Negatif"
1,"pempek radial asli palembang pempek lem telor lenjer ada lenjer kulit paket harga jangkau minat order dm","Positif"
1,"purwakarta september kirim harga telur blitar terima kota purwakarta harga rp sekian terimakasih","Positif"
0,"bbrp pantau harga telur turun harga murah kg beli","Netral"
-1,"syukur harga telur turun harga inflasi kasihan rakyat harga telur","Negatif"
-2,"ternak ayam telur blitar bagi telur gratis warga aksi wujud prihatin anjlok harga telur simak informasi lengkap link bawah","Negatif"
0,"artikel sebab harga telur turun sederhana harga timbang minta pasok harga turun lebih pasok danatau turun minta","Netral"
1,"negara bisaintervensi swasta stock pangan telur produksi pengaruh harga","Positif"
0,"ayo makan telor selagi harga telor murah","Netral"
0,"bpnt triwulan uda jalan pakai telor harga rangkak dkit minta rutin bulan turun panen jual pasar jenuh","Netral"
0,"nak bayar harga telur takpe nak cari hantu iland","Netral"
3,"lmajang priyo nina stmj maryadi harga telur turun ton jt rupiah ternak sedekah telur ton harga stabil untung ternak konsumen beli telur harga mahal dagang telur untung","Positif"
-1,"harga telor nyinyir perintah perhati konsumen ayam betanduk bejenggot chairil","Negatif"
0,"katjasungkana priyo nina stmj maryadi harga telur indonesia ribu kg blitar ribu kilogram telur great kwalitas kwalitas harga","Netral"
0,"katjasungkana priyo nina stmj maryadi jatim kabupaten standart harga telur","Netral"
-2,"event aksi prihatin kelompok ternak ayam kabupaten blitar bagi telur gratis warga selasa aksi telur kelompok ternak kabupaten blitar rangka prihatin harga telur anjlok rugi ternak","Negatif"
1,"harga telur hidup dagang kadang harga lambung kala harga anjlokpara ternak syukur putar harga","Positif"
1,"harga telur drop banget nambah pasu lumayan tipis wkwkwkwk cucu ilnam kejar setor cicil unit penthouse","Positif"
-2,"murah harga telur ayam ternak rugi telur ayam jalan sedih liat","Negatif"
0,"tani padi demo nuntut jokowi usaha ayamtelur harga gabah ankg","Netral"
-1,"merana harga telur ayam harga tinggi sejarah","Negatif"
1,"ribu ternak gelar aksi demo bagi telur ayam harga sesuaihet","Positif"
-1,"martabak bogor mahal mahal murah telor anjing harga segitu telor","Negatif"
-1,"ternak suara denger model bentangin poster turunin harga jagung konsentrat harga telur model protes diketawain grup ternak","Negatif"
-1,"harga telur pasar normal harga telur ayam broiler anjlok angka rprpkg rprpkg","Negatif"
2,"bumi karno getar saudara ternak suara aspirasi tuntut stabil harga telor merdeka","Positif"
-1,"fess open order ekado isi telur puyuh balut daging ayam isi mozarella harga kpack pcs dom malang disc ongkos kirim order mesan dm","Negatif"
-2,"harga pasar fresh pinggir jalan bak pickup telor jelek jual kandang emang segitu margin","Negatif"
1,"harga jagung alami naik lampau harga acu beli hap sesuai atur menteri dagang naik harga jagung dampak harga daging ayam telur industri unggas","Positif"
0,"minggu pas beli telor pasar dagang kasi ternak ayam pakan tetep mahal harga telor murah","Netral"
-1,"kemarin harga jagung turun ternak ayam rugi gilir telor harga turuninbentar harga cabe lonjak harga beras terjun bebassebenarnya perintah warga gobloq","Negatif"
-2,"pati ternak kabupaten pati keluh mahal harga pakan ternak sisi harga telur alami turun iring minta kurang","Negatif"
-1,"harga telur anjlok ternak ponorogo wadul dewan","Negatif"
0,"kemarin beli telur ngerasa murah banget harga telur","Netral"
0,"aksi telur ternak dilatarbelakangi harga telur turun aliansi ternak berduyunduyun baca lengkap","Netral"
-2,"harga telur anjlok ternak rugi salah ternak tasikmalaya rugi lantas bagi telur gratis warga","Negatif"
-1,"guis open order ekado isi telur puyuh balut daging ayam isi mozarella harga kpack pcs dom malang disc ongkos kirim order mesan dm","Negatif"
0,"harga telur murah harga makan ubah","Netral"
0,"untung rugi laku usaha turun hargatelur","Netral"
-2,"kontol puasa kilo segitu protes salah gajelas mainin harga expand demand ngotak harga puasa doang prospek mamam banyak telor","Negatif"
-2,"aksi bagibagi telur protes harga anjlok bubar polisi","Negatif"
-1,"ternak keluh harga telur ayam anjlok","Negatif"
0,"nasi masak beli telur turun harga banget kilo minggu","Netral"
-1,"perintah jokowi pakan jagung usaha pakan jalan normal masalah pakan ternak ayam lipat harga telur turun","Negatif"
1,"harga asli telor ceplokdadar","Positif"
-1,"harga anjlok ternak tasikmalaya bagibagi telur ton","Negatif"
-1,"jual telur tulungagung kadang ambil blitar harga nentuin ambil harga jual ngikutin harga pasar bingung mari diskusi","Negatif"
1,"perang harga dadak smua jual telur persis kaya tisu paseo jual produk","Positif"
0,"protes harga telur anjlok ternak blitar bagi telur gratis","Netral"
0,"emang perintah ngurusi harga telur","Netral"
-2,"sedih tani ayam telur modal pakan modal vaksin bulan ayam vitamin modal harga telur anjlok sedih baca tweet","Negatif"
-1,"muncul klaster telur blitar kasihan ternak telur blitar harga jual anjlok alias terjun bebas harga pakan roket","Negatif"
0,"bandung harga telur ayam turun akibat pakan jagungmurah","Netral"
0,"komoditas indonesia stock harga roket stock limpah harga jatuh dibuangbuang contoh cabai baput buah naga telur","Netral"
0,"main anak egg rolling board game keluarga seru lempar telur burung harga link","Netral"
4,"bagus protes telur manfaat terima bagus terima bel harga","Positif"
-1,"aksi bagi telur protes anjlok harga telur ayam","Negatif"
-1,"nagawa emang segitu turun cmn kisar doang kota malang demand telur mas kalik harga normal","Negatif"
1,"aku alami rugi total capai ratus juta rupiah kondisi harga aksi ribu warga blitar raya padat kawasan kankab kanigoro telur gratis yayuk warga kota blitar rela pergi kanigoro","Positif"
0,"kondisi harga telur harga akbp adhitya panji anom kapolres blitar polisi paksa bubar ternak layer blitar gelar selasa september jam pagi kantor","Netral"
0,"ternak blitar jawa timur rencana bagi telur gratis ton bentuk protes kait kurang perhati perintah harga beli telur anjlok pasar","Netral"
0,"harga telur anjlok ternak ayam blitar bagi ton telur cumacuma","Netral"
0,"harga telor ayam jeblok diskanak tuban oligarki kuasaipasar","Netral"
-1,"over supply harga telur ayam ras anjlok fit","Negatif"
-1,"aksi picu merosot harga telur harga pokok produksi luar wajar moga badai cepat ri","Negatif"
1,"harga telur terjun bebas","Positif"
0,"bang telor gulung harga pedes","Netral"
0,"harga telur ayam hancur ternak bagi telur via","Netral"
0,"ngeri harga telur merosot ternak blitar pusing telur bagi gratis panglima gatot soeharto lenteng agung","Netral"
0,"demo naikin harga telur telur","Netral"
0,"harga telur prancis turun","Netral"
0,"telur harga kg ayam harga","Netral"
-2,"nglempar blitar protes harga telur anjlok","Negatif"
0,"belikan telor kilo kasihin harga lipat","Netral"
0,"ternak magetan keluh harga telur ayam anjlok rp ribu kilogram ternak alami gulung tikar bagi telur guna jalan","Netral"
-1,"telor dadar harga mati","Negatif"
1,"harga anjlok ternak kabupaten blitar bagibagi telur gratis masyarakat koordinator aksi ternak kabupaten blitar wilayah barat imam kariadi ton telur bagi masyarakat","Positif"
2,"aksi prihatin ternak ayam blitar harga pakan harga telur terjun tanda bagi telur gratis lepas ayam telur net karya batas sabar doa","Positif"
0,"ternak blitar aksi bagibagi telur gratis bentuk protes harga telur","Netral"
0,"presiden prancis harga gampar lempar telor","Netral"
0,"telur ayam daerah depok notes beda toko beda harga","Netral"
0,"askrl harga telur ayam ayam potong daerah kgnya","Netral"
-1,"riverheaven mafia produsen pakan ternakprodusen monopoli habitat terna pakan induk ayam bibit ayam main produsen pakan harga telur turun harga pakan naik ternak kelojotanmummet","Negatif"
2,"protes anjlok harga telur mahal harga pakan ternak ayam magetan jawa timur unjuk bagi telur gratis jalan kantong isi kilogram telur bagi berita","Positif"
0,"heran juang melayu islam lalak harga telor naikskrg diam bisu barang hargabinawe betui","Netral"
2,"inovasi olah tepung telur ikhtiar bantu ternak itik jaga stabil harga produksi telur kondisi over supply selengkapnyagtgt","Positif"
0,"harga telur mmg murah banget kg","Netral"
-1,"new post harga telur anjlok ternak ayam rugi has been published baca pesan","Negatif"
0,"harga telur anjlok ternak blitar gelar aksi bagibagi telur gratis masyarakat","Netral"
1,"dee nikmat swasambada pangan kalang rakyat sanggup beli harga murah beli telur masak pakai tepung keluarga hemm","Positif"
-2,"aksi bagibagi telur bentuk prihatin ternak ayam telur terombangambing ketidakstabilan harga jual telur harga pakan","Negatif"
0,"mendag tan urus kisruh harga telur beres","Netral"
0,"turun harga telur gulung","Netral"
0,"moga harga telur murahkarena rakyat butuh telur","Netral"
1,"pempek radial asli palembang pempek lem telor lenjer ada lenjer kulit paket harga jangkau minat order dm","Positif"
0,"naik harga telor boiler","Netral"
0,"harga telur nyungsep","Netral"
0,"jadi trends naik harga telur","Netral"
0,"dkukmp kota banjar pantau harga butuh pokok telur","Netral"
-3,"kemendag pikir harga telur masyarakat penuh butuh gizi jalan salah langkah ambil telur ternak serap bansos lawan pandemi","Negatif"
1,"daya beli telur masyarakat alami turun kemendag baik harga telur ternak serap bansos ekonomi jalan profesional ternak","Positif"
0,"kini harga telur ayam rekod tinggi sejarah","Netral"
0,"dkukmp kota banjar pantau harga butuh pokok telur rakyat online","Netral"
1,"harga telur anjlok ternak bagi telur gratis warga","Positif"
-2,"aksi bagibagi telur bentuk prihatin ternak ayam telur terombangambing ketidakstabilan harga jual telur","Negatif"
1,"sori doc makan ikan harga ikan kembung ukur kang sayur aje ekor rebu ikan ukur ikan krismon rebu ekor makan butir telor hari aje udeh syukur banget","Positif"
1,"tanggerang september kirim harga telur blitar terima kota tanggerang harga rp sekian terimakasih","Positif"
0,"waingapu september kirim harga telur blitar tuju kota waingapu indonesia timur harga rp sekian terimakasih","Netral"
1,"kosambi september kirim harga telur blitar terima kota kosambi harga rp sekian terimakasih","Positif"
1,"purwakarta september kirim harga telur blitar terima kota purwakarta harga rp sekian terimakasih","Positif"
1,"bandung september kirim harga telur blitar terima kota bandung harga rp sekian terimakasih","Positif"
-2,"harga telur anjlok ternak pinsar magetan gelar aksi protes","Negatif"
0,"jarang makan bagai ikut tekak sedap isi telur jarang ingin belangkas ekor je jual range harga rmrm not worthy imo better beli ketam just cents","Netral"
0,"aksi ternak sorot harga telur murah budi daya ayam integrator usaha","Netral"
-1,"harga garam telur harga terong murahbelum tembakaumencari sumber kppu tugas urus saing bisnisknp wenang urus hasil tani kasihan tani hantam finansial psikologis","Negatif"
1,"mudah dongkrak harga telur ayam","Positif"
-1,"harga telur anjlok dinas tani kota banjar","Negatif"
0,"harga telor colek kayo","Netral"
1,"baik harga telur ternak serap bansos","Positif"
-1,"harga telur anjlok dinas tani kota banjar rakyat online","Negatif"
0,"net siap aksi prihatin harga telur ternak blitar telur lepas ayam monggo ken ayam gratis","Netral"
4,"aksi demo manfaat harga telur ayam stabil ternak ayam telur demonstrasi bagi telur ayam gratis guna jalan","Positif"
2,"martabak terang martabak bangka dsini martabak martabak terang martabak tipis martabak telur martabak pasar harga ribu","Positif"
0,"harga telur tmpatku butir","Netral"
1,"nerangin maksutnya harga telur murah masyarakat neng bknkh tunggu ternak contoh ajaneg tetangga telur gread abesarcuma rbrb gkpernah brubahdpt papan isi bj murahmahal","Positif"
1,"pempek radial asli palembang pempek lem telor lenjer ada lenjer kulit paket harga jangkau minat order dm","Positif"
0,"perintah upaya harga telur tingkat gizi masyarakat profesional ternak","Netral"
0,"perintah upaya harga telur tingkat gizi masyarakat profesional ternak","Netral"
1,"harga telur anjlog puluh ternak ayam telur bagibagi telur gratis","Positif"
1,"baik harga telur ternak serap bansos profesional ternak","Positif"
0,"kemarin harga telur ribukilo","Netral"
-2,"jibrill asmara harga telur anjlok dalam negeri timpang impor negeri impor menang harga telurpeternak anjlok paham","Negatif"
2,"sajak utriza hahahaha santai banget nunggu suami syukur allah ibadah aman suami ngantor aman harga telor sayur murah panik hahahhaha","Positif"
0,"puluh ternak ayam telur magetan gelar demo bagi telur gratis aksi gelar bentuk protes anjlok harga telur","Netral"
2,"kreativ cari solusihukum pasar gerus waktudemo harga pakan mahal ternak ayam magetan bagi telur gratis","Positif"
0,"puluh ternak ayam telur magetan gelar demo bagi telur gratis aksi gelar bentuk protes anjlok harga telur","Netral"
0,"puluh ternak ayam telur magetan gelar demo bagi telur gratis aksi gelar bentuk protes anjlok harga telur","Netral"
0,"asli bulan harga telur turun drastis","Netral"
0,"perintah upaya harga telur tingkat gizi masyarakat profesional ternak","Netral"
-2,"demam oooh demam trend harga telur turun hiyaaaa","Negatif"
1,"harga ayam telur jaga percaya cakap hahahaha","Positif"
-2,"harga telur anjlok rumah zakat borong ratus butir telur ternak","Negatif"
0,"harga telur emang turun kkkg murah banget stok telur nasional","Netral"
-1,"harga telur minyak beras dan lain korang jenis beli bulk derma dar bezanya harga kaw kaw malas cakep dh mampos","Negatif"
-1,"harga telur kandang enambelas enam ratus senin puluh tujuh september","Negatif"
0,"emange harga telur mgtn","Netral"
0,"naik harga telur ternak dampak pasar instruksi presiden jokowi telur jadi komponen bantu pangan non tunai","Netral"
0,"harga telur ayam itik capai rekod tinggi dalamsejarah","Netral"
0,"harga telur rbkg rugi ternak konsumen senang telur murah","Netral"
0,"puluh ternak ayam telur magetan bagi telur gratis pasar magetan laku bentuk kecewa anjlok harga jual telur","Netral"
1,"baik harga telur ternak serap bansos","Positif"
1,"harga ayam harga telur ayam itik pon naikxkan laa raja reja","Positif"
-2,"harga telur anjlok ternak blitar gelar aksi prihatin","Negatif"
0,"harga telur anjlok pakan ternak magetan bagi ton telor demo sedekah telur","Netral"
2,"aksi demo ternak telur magetan akinat stablinya harga telur bagi telur gratis warga magetan","Positif"
-1,"fess open order ekado isi telur puyuh balut daging ayam isi mozarella harga kpack pcs dom malang disc ongkos kirim order mesan dm","Negatif"
-1,"guis open order ekado isi telur puyuh balut daging ayam isi mozarella harga kpack pcs dom malang disc ongkos kirim order mesan dm","Negatif"
-1,"harga telor teken murah ternak rakyat mati sisa tengah gin kuat modal","Negatif"
0,"harga telur daging ayam jakarta turun pasok limpah","Netral"
-1,"ngeluh calon suami jual telur harga turun pasar kadang kadang engga istana negara beli telur produksi terna lumayan dapur istana ambil harga produsen tidak apa","Negatif"
0,"bahan pokok pasarpasar dki jakarta alami naik tipis naik harga cabai ayam telur","Netral"
-1,"ternak ayam magetan demo anjlok harga telur","Negatif"
0,"telur ayam merekodkan sejarah jual harga tempoh sembilan","Netral"
0,"harga telur jangkau manfaat masyarakat penuh butuh gizi","Netral"
1,"menteri dagang muhammad lutfi baik harga telur ternak serap bansos profesional ternak","Positif"
-1,"buntut harga telur anjlok harga jagung ternak gugat tan rp miliar via","Negatif"
1,"moga indonesia sehat capai harga telur jangkau masyarakat","Positif"
0,"harga telor turun bentuk banget kea peluang dapetin","Netral"
0,"data baharu terbit jabat khidmat veterinar jpv harga runcit biji telur ayam gred masingmasing jual sen sen sen","Netral"
0,"pasok limpah harga telur daging ayam jakartaturun","Netral"
0,"harga pakan lambung telur prediksi langka sumut","Netral"
-1,"sembang negara dapat harga barang dapor melambong menteri minyak masak telor daging ayam alami naik harga gila whats yr reaction this","Negatif"
0,"harga telur daging ayam turun","Netral"
2,"banting harga ayam boneless paha pack kualitas senin dapat hemat sumber protein baik untuk keluarga borong telur produk unggas sk laku region jabodetabek","Positif"
1,"terobos perintah presiden jokowi baik harga telur ternak serap bansos","Positif"
-1,"harga telur anjlok ternak temu perintah daerah","Negatif"
0,"tetiba makan telur goreng harga hkd nasib sedap","Netral"
-1,"harga telur pasar kudus anjlok rp","Negatif"
0,"salah terobos perintah jokowi baik harga telur ternak serap bansos muhammad lutfi","Netral"
-1,"buntut harga telur anjlok harga jagung ternak gugat tan rp miliar","Negatif"
1,"buku baru susu telur karya kawakami mieko terjemah asri pratiwi wulandari bahasa jepang diprapesan september harga diskon","Positif"
-2,"ternak ayam telor blitar besok menggekar aksi bagibagi telor gratis lepas ayam jalan wujud protes harga telor anjlok akibat ternak unggas integrator tanggap tan yang lain","Negatif"
-2,"ternak ponorogo gelar bazar edukasi warga anjlok harga telur lengkap","Negatif"
0,"nasi goreng rempah ready cabang indonesia harga rekomendasi ribu telor ceplok dadar","Netral"
-1,"rumah warung samping saing warung telor warung nurunin harga telor kilo","Negatif"
-1,"duluyang demo harga jagung mohon naik harga telur turun harga jagung akar harga jual telur rendah jokowi kirim jagung truk kirim truk isi uang beli telur harga","Negatif"
1,"menteri dagang muhammad lutfi upaya serap telur ternak untuk bantu sosial bansos perintah terobos baik harga telur anjlok","Positif"
1,"menteri dagang muhammad lutfi upaya serap telur ternak untuk bantu sosial bansos perintah masyarakat dampak pandemi covid upaya baik harga telur anjlok","Positif"
1,"baik harga telur ternak serap bansos","Positif"
1,"harga telur ayam jeblok mendag janji serap telurpeternak","Positif"
-3,"harga telur anjlok wktu jaman kuliah harga kkg lbih murahh kkg coba jogja kyanya kota kkg salah picu krena investor asing hm","Negatif"
0,"menteri dagang muhammad lutfi upaya serap telur ternak untuk bansos perintah masyarakat dampak pandemi covid upaya baik harga telur anjlok","Netral"
